District,City,Address,outlet_name,store_location
Gampaha,Gampaha,"KD HOUSE COMMUNICATION, 102 B, COLOMBO RD, GAMPAHA",KD HOUSE COMMUNICATION,POINT (79.99574009999999 7.0911073)
Gampaha,Gampaha,"SJS TECHNoLOGIES, 142/D, KANDY ROAD, MIRISWATTA, GAMPAHA",SJS TECHNoLOGIES,POINT (80.0162795 7.073305599999999)
Gampaha,Gampaha,"Vibrations Communication, Main Street, Ganemulla",Vibrations Communication,POINT (79.9607183 7.0664609)
Gampaha,Gampaha,"Saseka Communication And Watch Centre, No.62 Colombo Rd, Gampaha",Saseka Communication And Watch Centre,POINT (79.9949075 7.091444)
Gampaha,Gampaha,"DINITHI DISTRIYBUTORS, 125/E MUDUNPITHAKANDA RADAWANA, KIRINDIWELA",DINITHI DISTRIYBUTORS,POINT (80.09019259999999 7.0325501)
Gampaha,Gampaha,"SANASA BANK, 1040, KUMBURUGODA, BEMMULLA",SANASA BANK,POINT (79.9950449 7.0933189)
Gampaha,Gampaha,"Rangana Cellular, No.144 Negombo Rd, Veyangoda",Rangana Cellular,POINT (80.0574158 7.1548674)
Gampaha,Gampaha,"Sunwin Trading, Walgammulla Road, Rukgahawila",Sunwin Trading,POINT (79.892489 6.8765377)
Gampaha,Gampaha,"C.Net Computers, No.162/C Nittambuwa Road Pattalagedara, Veyangoda",C.Net Computers,POINT (80.0693105 7.151215799999999)
Gampaha,Gampaha,"CHAMEE PHONE SHOP, ATTANAGALLA RD,WATHUPITIWALA, WATHUPITIWAL",CHAMEE PHONE SHOP,POINT (80.11119649999999 7.1253896)
Gampaha,Gampaha,"Dholayan Tex And Communication, No.146/A Main Street, Kahatowita",Dholayan Tex And Communication,POINT (80.111746 7.095324)
Gampaha,Gampaha,"KUMARASINGHE BOOK SHOP, 397,WALIPITIWA, GANEMULLA",KUMARASINGHE BOOK SHOP,POINT (79.95691359999999 7.039191300000001)
Gampaha,Gampaha,"Hello Com, Oruthota Road, Gampaha, Gampaha",Hello Com,POINT (79.9867591 7.082963299999999)
Gampaha,Gampaha,"OMEEKA MOBILE, NO 11 KANDY ROAD, YAKKAIA, YAKKALA",OMEEKA MOBILE,POINT (80.0343185 7.084981399999999)
Gampaha,Gampaha,"ANURADHA COMMUNICATION, 151/14,KALUWALA JUNCTION,GANEMULLA",ANURADHA COMMUNICATION,POINT (79.97545269999999 7.0740902)
Gampaha,Gampaha,"SMART PHONE PLANENT, NO 372 KADAWATHA ROAD, .GANEMULLA, KADAWATHA ROAD",SMART PHONE PLANENT,POINT (79.9614498 7.0681381)
Gampaha,Gampaha,"Photo Guide, No.388 Kadawatha Road, Ganemulla",Photo Guide,POINT (79.9612075 7.067950799999999)
Gampaha,Ja ela,"S.M.Communication, 230-B, Batagama North, BatagamaJa Ela",S.M.Communication,POINT (79.91662199999999 7.0536403)
Gampaha,Kadawatha,"EXCELENT COMM, No.372/B2,KANDY RD,MAHARA, KADAWATHA",EXCELENT COMM,POINT (79.91517739999999 6.9706702)
Gampaha,Kadawatha,"ASIRI COMMUNICATION, No.207/2,9TH MILE POST,MAHARA, KADAWATHA",ASIRI COMMUNICATION,POINT (79.9453206 6.9944774)
Gampaha,Kadawatha,"GOLDEN A.P.O. & COMM, NIKADO CITY,KANDY RD, KADAWATHA",GOLDEN A.P.O. & COMM,POINT (79.9568542 7.005094199999999)
Gampaha,Katunayaka,"Nimali Communication, Ewariwatta, Katunayaka",Nimali Communication,POINT (79.8650871 7.1826544)
Gampaha,Kelaniya,"SAMANALA BOOK SHOP & COMM, No.497/A/1,ERIYAWETIYA RD, KELANIYA",SAMANALA BOOK SHOP & COMM,POINT (79.92863200000001 6.979513099999999)
Gampaha,Kiribathgoda,"MOBILE CELLULAR CITY, No:329,MAKOLA ROAD,THAMBILLGASMULLA JUNCTION, KIRIBATHGODA",MOBILE CELLULAR CITY,POINT (79.9279038 6.977646099999999)
Gampaha,Kirindiwela,"Kirindiwela Communication, Walgammulla Road, Kirindiwela",Kirindiwela Communication,POINT (80.12989759999999 7.0432317)
Gampaha,kocchikade,"Hameed Communication, No.176 Poruthota, Kochchikade",Hameed Communication,POINT (79.8448418 7.262289000000001)
Gampaha,kocchikade,"Diligent Communication, Church Road, Kochchikade",Diligent Communication,POINT (79.85869049999999 7.265313399999999)
Gampaha,Minuwangoda,"MALMI COMMUNICATION, 150,NEGOMBO RD,BORAGODAWATTA,MINUWANGODA",MALMI COMMUNICATION,POINT (79.8931382 7.0642801)
Gampaha,Minuwangoda,"SENAKA TELE SHOP, NO.34,ARAUND RD, DIULAPITIYA",SENAKA TELE SHOP,POINT (80.0191469 7.224236899999999)
Gampaha,Mirigama,"Mandakini Communication, Thalakolayaya, Meerigama",Mandakini Communication,POINT (80.1302748 7.248230700000001)
Gampaha,Mirigama,"PRABA COMMUNICATIONoN, MEERIGAMA RD, KOTADENIYAWA",PRABA COMMUNICATIONoN,POINT (80.1167652 7.2518058)
Gampaha,Mirigama,"DAYASEELA COMMUNICATION, 35,KANDALAMA,MIRIGAMA., MIRIGAMA",DAYASEELA COMMUNICATION,POINT (80.1368667 7.270834799999999)
Gampaha,Negambo,"CHAMARA CAFE, 05,MIRIHAMA RD, NEGAMBO",CHAMARA CAFE,POINT (79.84734349999999 7.2145134)
Gampaha,Negambo,"Best Phone Cafe, No 42/A , KIMBULAPITIYA ROAD, NEGAMBO",Best Phone Cafe,POINT (79.8487401 6.918108999999999)
Gampaha,Negambo,"NEW BASIYAWATTA BOOK SHOP, 336/6,MASA PITIPANA, NEGOMBO",NEW BASIYAWATTA BOOK SHOP,POINT (79.8401434 7.2116874)
Gampaha,Nittambuwa,"Sitasi Teleshop, Kittammahara, Nittambuwa",Sitasi Teleshop,POINT (80.0962061 7.1460957)
Gampaha,Nittambuwa,"Ananda Book Shop, Wathupitiwala, Nittambuwa",Ananda Book Shop,POINT (80.1115712 7.1248114)
Gampaha,Nittambuwa,"DINU CELLULAR AND COM CENTER, EPZ ROAD, WATHUPITIWALA, NITTAMBUWA",DINU CELLULAR AND COM CENTER,POINT (80.1081045 7.1231117)
Gampaha,Nittambuwa,"Dilini Communication, No.491b Kandy Road, Nittambuwa",Dilini Communication,POINT (79.9965905 7.092556399999999)
Gampaha,Nittambuwa,"Shishilasa Communication, No.424 Negombo Road, Nittambuwa",Shishilasa Communication,POINT (80.0949622 7.143777)
Gampaha,Nittambuwa,"TELECITY MOBILES, No:1,BUS STAND,NITTAMBUWA, NITTAMBUWA",TELECITY MOBILES,POINT (80.09645619999999 7.1406854)
Gampaha,Nittambuwa,"Real Phone Shop, No.601 Colombo Road, Nittambuwa",Real Phone Shop,POINT (80.094522 7.1415906)
Gampaha,Nittambuwa,"Vivid Type Setting, Ranpokunagama, Nittambuwa",Vivid Type Setting,POINT (80.1060408 7.130941000000001)
Gampaha,Nittambuwa,"NEW JAYANTHI STORES, 110,KANDY RD,KONGASDIYA, NITTAMBUWA",NEW JAYANTHI STORES,POINT (80.1034566 7.1524598)
Gampaha,Nittambuwa,"WORLD WIDE COMPUTER & MOBILE PHONE, 423, VEYANGODA RD, NITTAMBUWA",WORLD WIDE COMPUTER & MOBILE PHONE,POINT (80.0948669 7.1437654)
Gampaha,Nittambuwa,"DISNA BOOK SHOP, 650, ATTANAGALLA RD,, NITTAMBUWA",DISNA BOOK SHOP,POINT (80.1005529 7.1307934)
Gampaha,Nittambuwa,"Sagara Communication, No.272 C Negombo Road, Nittambuwa",Sagara Communication,POINT (79.8507987 7.2063801)
Gampaha,Pamunugama,"Anne Communication, No.20 Bopitiya Junction Bopitiya, Pamunugama",Anne Communication,POINT (79.85932249999999 7.0788987)
Gampaha,Pasyala,"Ideal Communication, No.184 Kandy Road, Pasyala",Ideal Communication,POINT (80.12414989999999 7.1685253)
Gampaha,Pugoda,"GANGA BOOK SHOP, 344/1,PUGODA RD, MANDAWALA",GANGA BOOK SHOP,POINT (80.0961531 7.000578300000001)
Gampaha,Pugoda,"NAYOMI COM, MAIN STREET , PUGODA",NAYOMI COM,POINT (80.0588832 6.9500131)
Gampaha,Pugoda,"Unilanka A.P.O., No.144 Main Street, Pugoda",Unilanka A.P.O.,POINT (80.11960280000001 6.9753985)
Gampaha,Ragama,"LUCKY COMM CENTER, 646/B, THEWATTA RD, RAGAMA",LUCKY COMM CENTER,POINT (79.9217376 7.0304552)
Gampaha,Ragama,"Sandali Communication, No.800 Magammana, Ragama",Sandali Communication,POINT (79.7999348 7.486975699999999)
Gampaha,Ragama,"Samagi Communication, No.758/A Negombo Road Mattumagala, Ragama",Samagi Communication,POINT (79.89934360000001 7.021228000000001)
Gampaha,seeduwa,"Sd Studio And Communication, No.610d Liyanagemulla, Seeduwa",Sd Studio And Communication,POINT (79.8725408 7.1509399)
Gampaha,seeduwa,"Tele One Com, No.319 Kotugoda Road, Seeduwa",Tele One Com,POINT (79.87412599999999 7.144237599999999)
Gampaha,seeduwa,"TIYOSHI COM, 202/A1,BASE LINE ROAD, AMANDOLUWA,SEEDUWA",TIYOSHI COM,POINT (79.88410309999999 7.146047599999999)
Gampaha,seeduwa,"Shamaly Stores, No.147b Kebellagodawela Alawathupitiya, Seeduwa",Shamaly Stores,POINT (79.87599329999999 7.133221799999999)
Gampaha,seeduwa,"Sky Com, No.96 Kotugoda Road, Seeduwa",Sky Com,POINT (79.88196309999999 7.131685399999999)
Gampaha,seeduwa,"Masha Communication, No.301 Kotugoda Road, Seeduwa",Masha Communication,POINT (79.88213519999999 7.1319994)
Gampaha,Wattala,"Trs Netcafe, No.55d Elakanda Road Hendala, Wattala",Trs Netcafe,POINT (79.8784151 6.995450200000001)
Gampaha,Wattala,"Nandana Traders, No.455 Negombo Road, Wattala",Nandana Traders,POINT (79.8926149 6.9901493)
Gampaha,Wattala,"E Com Communication, No.16 Welikadamulla Road Mabola, Wattala",E Com Communication,POINT (79.88707540000001 6.996803799999999)
Gampaha,Wattala,"Nisha Communication, No.23 Hendala, Wattala",Nisha Communication,POINT (79.8753507 6.994657399999999)
Gampaha,Wattala,"Wedage Com, Kerawalapitiya Rd Hendala, Wattala",Wedage Com,POINT (79.88731129999999 6.996572)
Hambanthota,Angunukolapelessa,"Manaram Communication, Hungama Road, Angunukolapelessa",Manaram Communication,POINT (80.9031172 6.165568899999999)
Hambanthota,Angunukolapelessa,"Ranaweera Communuication, Hungama Road, Angunukolapelessa",Ranaweera Communuication,POINT (80.89867610000002 6.166125)
Hambanthota,Angunukolapelessa,"Dahanayaka Electronics, Hungama Road, Angunukolapelessa",Dahanayaka Electronics,POINT (80.89892789999999 6.1660319)
Hambanthota,Angunukolapelessa,"Ishara Compiuter Shop, no 33 Benkama, Angunakolapalssa",Ishara Compiuter Shop,POINT (79.857941 6.8968113)
Hambanthota,Ambalanthota,"HANSANI HOTEL, MAMADALA, AMBALANTHOTA",HANSANI HOTEL,POINT (80.92424419999999 6.1056794)
Hambanthota,Ambalanthota,"ISURU AGENCIES, 69,MAIN ST,AMBALANTOTA",ISURU AGENCIES,POINT (81.02437479999999 6.1225152)
Hambanthota,Ambalanthota,"SILVER JEWELLERS, 39,MAIN STREET, AMBALANTHOTA",SILVER JEWELLERS,POINT (79.85400109999999 6.9391151)
Hambanthota,Beliatta,"A.M.S.Mobile Phone Shop, No.07 1st Floor New Shopping Complex, Beliatta",A.M.S.Mobile Phone Shop,POINT (80.73498000000001 6.047829)
Hambanthota,Beliatta,"Cell Way The Phone Shop (pvt)ltd, NEW Bus Stand, Beliatta",Cell Way The Phone Shop (pvt)ltd,POINT (79.99616979999999 7.092600999999999)
Hambanthota,Hambanthota,"Shawindu Communication, Baddawala Road, HAMBANTHOTA",Shawindu Communication,POINT (81.1263189 6.1324511)
Hambanthota,Hambanthota,"Wanniarachchi Traders, No.64 Tangalle Rd, Hambantota",Wanniarachchi Traders,POINT (81.11888809999999 6.1245543)
Hambanthota,Hambanthota,"Hambanthota Agency, No.64 Bazaar Street, Hambanthota",Hambanthota Agency,POINT (81.124816 6.125432)
Hambanthota,Hambanthota,"Dammi Communication, Urubokka Road, Katuwana",Dammi Communication,POINT (80.60542270000001 6.323059)
Hambanthota,Hambanthota,"Hiru Communication, Middaniya Road, Katuwan",Hiru Communication,POINT (80.6914366 6.2648239)
Hambanthota,Hambanthota,"Nenasala, Welangahawala Junction, Barawakumbuka",Nenasala,POINT (79.988187 7.2286314)
Hambanthota,HUNGAMA,"GAJANAYAKA COMMUNICATION, 22,MAIN STREET, HUNGAMA",GAJANAYAKA COMMUNICATION,POINT (79.85018409999999 6.9369983)
Hambanthota,Middeniya,"Abeywarna Phone Shop, Panamura Road, Middeniya",Abeywarna Phone Shop,POINT (80.7643631 6.251900099999999)
Hambanthota,Middeniya,"Ruhunu Mobile The Phone Shop, Walasmulla Road, Middeniya",Ruhunu Mobile The Phone Shop,POINT (80.763649 6.2511236)
Hambanthota,Sewanagala,"Donald Stores, Mahagama Colony, Sewanagala",Donald Stores,POINT (80.9431453 6.3186609)
Hambanthota,Sooriyawewa,"Olu Communication, No.41 Main Street, Sooriyawewa",Olu Communication,POINT (79.8533577 6.921549400000001)
Hambanthota,Sooriyawewa,"Udarata Stores, No.88-1 Near The Bus Stand, Sooriyawewa",Udarata Stores,POINT (81.0022848 6.305901700000001)
Hambanthota,Sooriyawewa,"WIN-TEC COMPNTERS AND PHON SHOP, NO43 MAIN STREET, SOORIYAWEWA",WIN-TEC COMPNTERS AND PHON SHOP,POINT (79.8513626 6.9378833)
Hambanthota,Sooriyawewa,"Thisara Communication, Fourway Junction Viharagala, Sooriyawewa",Thisara Communication,POINT (79.96415689999999 6.842120400000001)
Hambanthota,Sooriyawewa,"Induwara Stores, No 39, Main Street, Sooriyawewa",Induwara Stores,POINT (80.5157019 5.9390198)
Hambanthota,Tangalle,"Isuru Communication, Anna Pitiya Road, Tangalle",Isuru Communication,POINT (80.7946256 6.0275168)
Hambanthota,Tangalle,"Dinisuru Print Shop & Communication, 53, Beliatta road, Tangalle",Dinisuru Print Shop & Communication,POINT (80.7821823 6.0367145)
Hambanthota,Tangalle,"Wijesinghe Agency Post Office, Polommaruwa, Tangalle",Wijesinghe Agency Post Office,POINT (80.796386 6.0230044)
Hambanthota,Tangalle,"Selmin, No.44, Beliatta Road, Tangalle",Selmin,POINT (80.73384159999999 6.0504335)
Hambanthota,Tissamaharama,"CHAT COMM, MATARA ROAD, THISSAMAHARAMA",CHAT COMM,POINT (81.28640039999999 6.2776894)
Hambanthota,Tissamaharama,"H.M.C. Holdings (pvt) Ltd, Main Street , Tissamaharama",H.M.C. Holdings (pvt) Ltd,POINT (79.8890802 7.1705048)
Hambanthota,Tissamaharama,"Lasantha Hardware, Hambantota Rd Gajasiripura, Thissamaharama",Lasantha Hardware,POINT (81.2630037 6.2689298)
Hambanthota,Tissamaharama,"Lucky Shoe Palace, No.25 Main Street, Thissamaharama",Lucky Shoe Palace,POINT (81.2887688 6.277070999999999)
Hambanthota,Walasmulla,"A.H.T.Communication, No.29 Pallekanda Road, Walasmulla",A.H.T.Communication,POINT (80.69727639999999 6.1577614)
Hambanthota,Walasmulla,"Nihal Cafe, No.7 Middeniya Road, Walasmulla",Nihal Cafe,POINT (80.69775039999999 6.1557628)
Hambanthota,Weerakatiya,"SHANNoN AUDIO & VIDEO, TANGALLE RD, WEERAKETIYA",SHANNoN AUDIO & VIDEO,POINT (80.76365969999999 6.146646199999999)
Jaffna,Chankanai,"Thirumagal Communication Travels, MAIN STREET, CHANKANAI, JAFFNA",Thirumagal Communication Travels,POINT (79.969199 9.748554)
Jaffna,Chavakachcheri,"MADDUVILL NET CAFE, MADDUVIL NoRTH, CHAVAKACHCHERI",MADDUVILL NET CAFE,POINT (80.16104439999999 9.659603299999999)
Jaffna,Jaffna,"ANANDA PHARMACY, OORANAI,VALVETTITHURAI, JAFFNA",ANANDA PHARMACY,POINT (80.0118607 9.690695399999999)
Jaffna,Jaffna,"Selin Communication, Erlalai West, Chunnakam",Selin Communication,POINT (79.8533577 6.921549400000001)
Jaffna,Jaffna,"CELL CITY, No.187  k.k.s. road, Jaffna",CELL CITY,POINT (80.0091468 9.667019399999999)
Jaffna,Jaffna,"Vadival Watch Works, 25/15 Jubilee Bazaar Power House RD, jaffna",Vadival Watch Works,POINT (80.0152231 9.668713700000001)
Jaffna,Jaffna,"K.S.M.Communication, No.146 New Market, Jaffna",K.S.M.Communication,POINT (80.0200366 9.6844517)
Jaffna,Jaffna,"ABI NET CAFE, NO 143,MAIN STREET NELLIYADI, Jaffna",ABI NET CAFE,POINT (80.197935 9.799723)
Jaffna,Jaffna,"Pan City Com, Sithankeny Road, Pandaytheruppu, Jaffna",Pan City Com,POINT (80.0144227 9.665109899999999)
Jaffna,Jaffna,"SUTHA COMMUNICATION, SITHANKERNY JUNCTION, SITHANKERNY, Jaffna",SUTHA COMMUNICATION,POINT (79.96199 9.7538629)
Jaffna,Jaffna,"Kugans Electricals, Vaddu East, Sithankerny",Kugans Electricals,POINT (79.85625379999999 6.891932)
Jaffna,Jaffna,"Sun Rise Studio & Stationary, Chunnakam",Sun Rise Studio & Stationary,POINT (80.1226805 6.1127968)
Jaffna,Kayts,"Kayts Phone Shop, Oluvil Road , Kayts",Kayts Phone Shop,POINT (79.8632016 9.7012657)
Jaffna,Kopay,"Kajamugan Com, No.15 Kopay Junction, Kopay",Kajamugan Com,POINT (80.06913349999999 9.7043108)
Jaffna,Point Pedro,"Pragash Electronics, Bus Stand, Point Pedro",Pragash Electronics,POINT (80.2364431 9.8247214)
Jaffna,Point Pedro,"Rajan Cycle Works, Bus Stand, Point Pedro",Rajan Cycle Works,POINT (80.236695 9.824679999999999)
Kalutara,"Agalawatta,","Tharaka Tailors, No.207 Kithulgoda, Agalawatta",Tharaka Tailors,POINT (80.1763478 6.512537399999999)
Kalutara,Aluthgama,"Express Video, Aluthgama Bus Stand, Galle Road, Aluthgama",Express Video,POINT (79.99837789999999 6.4319881)
Kalutara,Aluthgama,"Thirasara Book Shop, No.4, Station Rd, Aluthgama",Thirasara Book Shop,POINT (79.99947809999999 6.431950899999999)
Kalutara,Aluthgama,"D P C Agency Post Office, No.268a Galle Road, Aluthgama",D P C Agency Post Office,POINT (80.00006429999999 6.4310892)
Kalutara,Aluthgama,"See Madura Book Shop, No.6, douglas gunawardene mawatha, Aluthgama",See Madura Book Shop,POINT (79.886259 6.758928)
Kalutara,Aluthgama,"Fun Time Call Center, No.55 Mathugama Road, Aluthgama",Fun Time Call Center,POINT (80.0029175 6.4313769)
Kalutara,Aluthgama,"Oasis Center, No.215 Galle Road, Aluthgama",Oasis Center,POINT (79.9988764 6.4314892)
Kalutara,Aluthgama,"Aqua Life And Comm, No.277 Galle Road, Aluthgama",Aqua Life And Comm,POINT (79.9982572 6.432593499999999)
Kalutara,Aluthgama,"MULTY CHOICE, 12/C, STATION RD, ALUTHGAMA",MULTY CHOICE,POINT (79.9988815 6.4317721)
Kalutara,Aluthgama,"Jayamini Book Shop, No.224, Kandavihara Road, Kaluwammodara, Aluthgama",Jayamini Book Shop,POINT (79.999099 6.4332452)
Kalutara,Aluthgama,"Smart Mobile, No.89, Galle Rd, Aluthgama",Smart Mobile,POINT (79.99582839999999 6.4371152)
Kalutara,Aluthgama,"H.S.Communication, 379/A,Bamunumulla,Atulugama",H.S.Communication,POINT (79.996315 6.7048537)
Kalutara,Baduraliya,"New Liyanaarachchi Communication And Grocery, No.474 Rathnapura Road, Baduraliya",New Liyanaarachchi Communication And Grocery,POINT (80.2343157 6.5157497)
Kalutara,Baduraliya,"Nadeesha Communication, No.09 Public Super Market Rathnapura Road, Baduraliya",Nadeesha Communication,POINT (80.23251639999999 6.5166609)
Kalutara,Baduraliya,"Sanadi Book Shop, Rathnapura Road, Baduraliya",Sanadi Book Shop,POINT (80.23256689999999 6.5166208)
Kalutara,Baduraliya,"VICTORY COMMUNICATION, LATHPADURA, BADURALIYA",VICTORY COMMUNICATION,POINT (81.0572732 6.988162)
Kalutara,Baduraliya,"Sahan Book Shop And Communication, No.28 Rathnapura Road, Baduraliya",Sahan Book Shop And Communication,POINT (80.2260077 6.5160679)
Kalutara,Baduraliya,"Devasee Book Shop And Communication, Rathnapura Road, Baduraliya",Devasee Book Shop And Communication,POINT (80.23176049999999 6.516988899999999)
Kalutara,Baduraliya,"Kumudu Book Shop, Rathnapura Road, Baduraliya",Kumudu Book Shop,POINT (80.23256689999999 6.5166208)
Kalutara,Baduraliya,"Sanadi Book Shop, Rathnapura Road , Baduraliya, na",Sanadi Book Shop,POINT (80.23256689999999 6.5166208)
Kalutara,Bandaragama,"Yasiru Communication And Book Shop, No.302/A, Bandaragama",Yasiru Communication And Book Shop,POINT (80.0152167 6.7217078)
Kalutara,Bandaragama,"Tharindu A.P.O., Kothalawala, Bandaragama",Tharindu A.P.O.,POINT (79.9906184 6.7109149)
Kalutara,Bandaragama,"Internet Cafe, Aluthgama Welmilla Junction, Bandaragama",Internet Cafe,POINT (79.88007109999999 6.930149)
Kalutara,Bandaragama,"Shashikala Communication And Book Shop, Gelanigama, Bandaragama",Shashikala Communication And Book Shop,POINT (80.0005488 6.718802699999999)
Kalutara,Bandaragama,"Nithma Phone Arcade, Market Avenue, Bandaragama",Nithma Phone Arcade,POINT (79.9896748 6.7142483)
Kalutara,Bandaragama,"Sayara Salon And Communication, Atulugama, Bandaragama",Sayara Salon And Communication,POINT (79.99638449999999 6.694441299999999)
Kalutara,Beruwala,"Celltrics, No.117/A, Galle Road, Beruwala",Celltrics,POINT (79.98315149999999 6.4763722)
Kalutara,Beruwala,"MH. lanka Commi., No.58, Mosque Rd, Beruwala",MH. lanka Commi.,POINT (79.9868048 6.4636912)
Kalutara,Beruwala,"Mobile Express Communication, No.126 Galle Road, Beruwala",Mobile Express Communication,POINT (79.9836552 6.4749487)
Kalutara,Beruwala,"Eropean Mobile, No.108 Galle Road, Beruwala",Eropean Mobile,POINT (79.986831 6.460038)
Kalutara,Beruwala,"Suba Video Centre And Communication, Ambepitiya, Beruwala",Suba Video Centre And Communication,POINT (79.98080890000001 6.4643155)
Kalutara,Beruwala,"More tel & Communication, No,123, Galle Rd, Beruwala",More tel & Communication,POINT (79.9831753 6.476299699999999)
Kalutara,Beruwala,"U Com Communication And Grocery, Ambalappola Road Marakkala Watta, Beruwala",U Com Communication And Grocery,POINT (79.9834779 6.4760545)
Kalutara,Beruwala,"Classic Mobile, No.135/A, Galle Road, Beruwala",Classic Mobile,POINT (80.00081489999999 6.4116572)
Kalutara,Beruwala,"Finaz Music And Communication, No.24 Galle Road Hettimulla, Beruwala",Finaz Music And Communication,POINT (79.98654859999999 6.4511106)
Kalutara,Beruwala,"ST, ANTHONYS COMMUNICATION, 77/F, CUSTOM RD, BERUWALA",ST,POINT (79.9196879 6.968276599999999)
Kalutara,Beruwala,"FINE COMM, 83-A,AGENCY POST OFFICE,GALLE RD., BERUWALA",FINE COMM,POINT (80.21762210000001 6.033414199999999)
Kalutara,Beruwala,"Masha A Mosquito Net And Gift Items, No.239/A Galle Road Massala, Beruwala",Masha A Mosquito Net And Gift Items,POINT (79.98654669999999 6.451115)
Kalutara,Bulathsinhala,"Liyanage Communication, No.178 Egaloya, Bulathsinhala",Liyanage Communication,POINT (79.93994719999999 6.9735396)
Kalutara,Bulathsinhala,"Ruwan Printers, Egaloya, Bulathsinhala",Ruwan Printers,POINT (80.16168089999999 6.6798573)
Kalutara,Bulathsinhala,"Kalana Grocery And Communication, No.14, Bulathsinhala",Kalana Grocery And Communication,POINT (79.8672474 6.8596184)
Kalutara,Bulathsinhala,"Smart Phone Shop, 53, Athura , Bulathsinghala, na",Smart Phone Shop,POINT (79.89879379999999 6.8749655)
Kalutara,Bulathsinhala,"National Book Shop & Communication, Amaragedara , Bulathsinghala, Bulathsinghala",National Book Shop & Communication,POINT (80.17832990000001 6.648947799999999)
Kalutara,Bulathsinhala,"Sahan Vedio, Athura,Bulathsinghala",Sahan Vedio,POINT (80.1638755 6.679041)
Kalutara,Dodangoda,"RANAWEERA STORES, TUDUGALA, Dodangoda",RANAWEERA STORES,POINT (80.04750399999999 6.562742399999999)
Kalutara,Dodangoda,"Kothalawala Photo And Wedding Needs, Thudugala Junction, Dodangoda",Kothalawala Photo And Wedding Needs,POINT (80.0244929 6.5550206)
Kalutara,Horana,"Horana Oil Mart, No.143 Panadura Road, Horana",Horana Oil Mart,POINT (80.05901539999999 6.7176059)
Kalutara,Horana,"Sanduni Communication, No.193 Ratnapura Road, Horana",Sanduni Communication,POINT (80.21461140000001 6.937644)
Kalutara,Horana,"Serandib Communication, No.110 Rathnapura Road, Horana",Serandib Communication,POINT (80.06335199999999 6.7165629)
Kalutara,Horana,"Pradeepa Book Shop And Communication, No.571/A Panadura Road, Horana",Pradeepa Book Shop And Communication,POINT (80.0440864 6.721125499999999)
Kalutara,Horana,"Sun Video Center, No.44 Anguruwathota Road, Horana",Sun Video Center,POINT (80.06946719999999 6.7098764)
Kalutara,Horana,"MENIKE FOOD, No 52.KULUPONA.POKUNUWITA, HORANA",MENIKE FOOD,POINT (80.03930059999999 6.732124199999999)
Kalutara,Horana,"Premathilaka Stores, 10/138,Anguruwathota Road, Horana",Premathilaka Stores,POINT (80.0628753 6.7153338)
Kalutara,Horana,"Pubudu Phone Shop, Suderis Silva Road, Horana",Pubudu Phone Shop,POINT (80.0580925 6.7159304)
Kalutara,Horana,"Susara Agency Post Office, Munagamapura Junction, Horana",Susara Agency Post Office,POINT (80.0598818 6.696884)
Kalutara,Horana,"J.K.Phone, Panadura Road,Horana",J.K.Phone,POINT (80.05798229999999 6.718514799999999)
Kalutara,Horana,"Linej Communication, 185,Panadura road,Horana",Linej Communication,POINT (80.06335199999999 6.7165629)
Kalutara,Horana,"Ariyarathne Trading, No.63 Padukka Road, Horana",Ariyarathne Trading,POINT (80.05533919999999 6.722236)
Kalutara,Horana,"MATHISHA BOOK SHOP, 330/B, DOBAGODA, HORANA",MATHISHA BOOK SHOP,POINT (80.06252119999999 6.7112038)
Kalutara,Horana,"SHIHARA ELECTRONIC & ELECTRONIC, COLOMBO ROAD,POKUNUWITA, HORANA",SHIHARA ELECTRONIC & ELECTRONIC,POINT (80.0551431 6.720237)
Kalutara,Kalutara,"MEEDUM BOOK SHOP  &   VIDEO CENTER, UGGALGODA KALUTARA, NoRTH, Kalutara North",MEEDUM BOOK SHOP  &   VIDEO CENTER,POINT (79.95310069999999 6.6082914)
Kalutara,Kalutara,"Star Communication, No.374 Galle Road, Kalutara North",Star Communication,POINT (79.90758529999999 6.7098347)
Kalutara,Kalutara,"SaNokma Mobile And Book Shop, No.73a Galle Road, Kalutara North",SaNokma Mobile And Book Shop,POINT (79.9284289 6.6675666)
Kalutara,Kalutara,"SAMPATH TOYS & COMMUNICATION, No,287,GALLE ROAD, KALUTARA NoRTH",SAMPATH TOYS & COMMUNICATION,POINT (79.9618653 6.579875599999999)
Kalutara,Kalutara,"Abdullah Phone Shop, No.668, Galle Rd, Kalutara South",Abdullah Phone Shop,POINT (79.9620319 6.5805973)
Kalutara,Kalutara,"Sena Tele Call, No.C2 Supper Market, Kalutara South",Sena Tele Call,POINT (79.96072699999999 6.5825293)
Kalutara,Kalutara,"Dilakro Book Shop, No.900/B Galle Road Katukurunda, Kalutara",Dilakro Book Shop,POINT (79.96150659999999 6.581016699999999)
Kalutara,Kalutara,"Speed Dial Communication, No.441 Main Road, Kalutara South",Speed Dial Communication,POINT (79.9657454 6.5704768)
Kalutara,Kalutara,"Mobile Lee, No.34B, Station Rd, Kalutara",Mobile Lee,POINT (79.96701200000001 6.5602822)
Kalutara,Kalutara,"Star Communication, Station RdKalulara South",Star Communication,POINT (79.85096990000001 7.215993099999999)
Kalutara,Kalutara,"STUDIO PHOTO BOOK, NAGODA RD,KATUKURUNDA JUNCTION, KALUTARA",STUDIO PHOTO BOOK,POINT (79.9691491 6.561103999999999)
Kalutara,Kalutara,"M.S.Communication, No.638 Galle Road, Kalutara South",M.S.Communication,POINT (79.85176249999999 6.937959)
Kalutara,Kalutara,"Communication Centre, No.2a Nagoda Road Katukurunda, Kalutara",Communication Centre,POINT (79.98093679999999 6.561081600000001)
Kalutara,Kalutara,"Hitec Phone Shop And Communication, No.6 New Bus Stand, Kalutara South",Hitec Phone Shop And Communication,POINT (79.9620366 6.5805725)
Kalutara,Kalutara,"Sampath Communication, No.271, Old Road, Kalutara South",Sampath Communication,POINT (79.9618653 6.579875599999999)
Kalutara,Kalutara,"Gayan Trade Center, No.21 Kalutara Road Yala, Anguruwathota",Gayan Trade Center,POINT (79.9699054 6.561727599999999)
Kalutara,Kalutara,"DINANGA COMMUNICATION, HORANA ROAD,GALPATHA, KALUTARA",DINANGA COMMUNICATION,POINT (79.96890739999999 6.6198935)
Kalutara,Kalutara,"Pradeep Communication, No.316 Galle Road, Kalutara North",Pradeep Communication,POINT (79.965929 6.5698039)
Kalutara,Kalutara,"Tirota Enterprises, Malwatta Junction Uggalboda Junction, Kalutara North",Tirota Enterprises,POINT (79.8533577 6.921549400000001)
Kalutara,Kalutara,"Isuru Communication, Near The Haritha Uyana Batagoda, Galpatha",Isuru Communication,POINT (79.8533577 6.921549400000001)
Kalutara,Kalutara,"E Center, No.531a Kuda Aruggoda, Alubomulla",E Center,POINT (79.9574001 6.7144117)
Kalutara,Kalutara,"VISION GRHAPICS, NO;350 NANDUWA JUNTION,MORONTHUDUWA, WADDUWA",VISION GRHAPICS,POINT (79.97465509999999 6.6524299)
Kalutara,Kalutara,"Mega Communication And Book Shop, No.20 Kumbuka, Gonapola Junction",Mega Communication And Book Shop,POINT (80.0010432 6.7202141)
