District,City,Address,outlet_name,store_location
Matara,Matara,"Abeysooriya Communication, Edirisinghe Building, Gandara",Abeysooriya Communication,POINT (79.8533577 6.921549400000001)
Matara,Matara,"Jeewana, ""Jeewana"" Matara Road, Kamburupitiya",Jeewana,POINT (80.56505349999999 6.0783573)
Matara,Mirissa,"ORCHID COMMUNICATION, 05,SUPER MARKET, MIRISSA",ORCHID COMMUNICATION,POINT (80.4586637 5.946752099999999)
Matara,Mirissa,"LAKMAL COMMUNICATION, 103,HAKMANA RD, MATARA",LAKMAL COMMUNICATION,POINT (80.5458009 5.9534896)
Matara,Morawaka,"E Plus Cellular Center, Near The Bus Stand, Morawaka",E Plus Cellular Center,POINT (80.4918809 6.2615473)
Matara,Morawaka,"Supertei Distributers (Pvt) Ltd., Deniyaya Road, Morawaka",Supertei Distributers (Pvt) Ltd.,POINT (80.4922773 6.2604612)
Matara,Morawaka,"The Phone Shop, Deniyaya rd, Morawaka",The Phone Shop,POINT (80.4918831 6.2616085)
Matara,Morawaka,"Gamage Communication, Neluwa Road Kalubovitiyana, Morawaka",Gamage Communication,POINT (80.40819019999999 6.3520118)
Matara,Morawaka,"Dasatha Communication, Milalla, Morawaka",Dasatha Communication,POINT (80.4969926 6.2685195)
Matara,Morawaka,"Sanila Studio, Deniyaya Road, Morawaka",Sanila Studio,POINT (80.5725927 6.3598414)
Matara,Pitabeddara,"Thineth Internet Cafe, Deniyaya Rd, Pitabeddara",Thineth Internet Cafe,POINT (80.0157449 6.9507844)
Matara,Pitabeddara,"Sisara Phone Shop, 3rd Step, Darangala, Pitabaddara",Sisara Phone Shop,POINT (80.06291379999999 6.7165985)
Matara,Pitabeddara,"CHATHUMIN MOBILE, AKURESSA RD, PITABADDARA",CHATHUMIN MOBILE,POINT (80.4739613 6.200969799999999)
Matara,Pitabeddara,"Isuru Communication, Deniyaya Road, Pitabeddara",Isuru Communication,POINT (80.4731178 6.2010475)
Matara,Pitabeddara,"Vindana Hotel And Grocery, Malpudanella, Pitabeddara",Vindana Hotel And Grocery,POINT (80.468655 6.1963004)
Matara,Thelijjawila,"Lihini.Com, No.04 Matara Road, Thelijjawila",Lihini.Com,POINT (80.37168939999999 5.9684595)
Matara,Thelijjawila,"Madumal Communication, Akuressa Road, Thelijjawila",Madumal Communication,POINT (80.4958384 6.0249864)
Matara,Urubokka,"Mayura Grocery, Bengamuwa, Urubokka",Mayura Grocery,POINT (79.85520149999999 6.942432200000001)
Matara,Walasmulla,"A.H.T.Communication, No.29 Pallekanda Road, Walasmulla",A.H.T.Communication,POINT (80.69727639999999 6.1577614)
Matara,Weligama,"NEW EXCEELENT COM, MEDA MW, WELIGAMA",NEW EXCEELENT COM,POINT (80.43005769999999 5.9743897)
Matara,Weligama,"SAMINDA DIGITAL IMAGE & VIDEO, MIDIGAMA, WELIGAMA",SAMINDA DIGITAL IMAGE & VIDEO,POINT (80.39076109999999 5.96813)
Matara,Weligama,"Chat Communication, Chat Communication Main Street, Weligama",Chat Communication,POINT (80.42486 5.974353)
Matara,Welihinda,"Excelent Communication, Welihinda, Denipitiya",Excelent Communication,POINT (80.465852 5.9836319)
Matale,Dambulla,"G.S.Record Bar And Communication, No.774 Anuradhapura Road, Dambulla",G.S.Record Bar And Communication,POINT (79.8538123 8.0305044)
Matale,Dambulla,"Nuwan Phone Center, No.784/B Anuradhapura Road, Dambulla",Nuwan Phone Center,POINT (80.6488756 7.8882134)
Matale,Dambulla,"Sigiri Cellular Centre, No.B-40 New Bus Stand, Dambulla",Sigiri Cellular Centre,POINT (80.6515938 7.870204299999999)
Matale,Dambulla,"M.L.M. Phone Shop, No.588 Anuradhapura Road, Dambulla",M.L.M. Phone Shop,POINT (80.6510569 7.876280299999999)
Matale,Dambulla,"Sahara Agency Post Office, No.561 Anuradhapura Road, Dambulla",Sahara Agency Post Office,POINT (80.65128319999999 7.862732800000001)
Matale,Dambulla,"Senith Communication, No.455 Kurunegala Junction, Dambulla",Senith Communication,POINT (80.6509191 7.874519800000001)
Matale,Dambulla,"Sujeewa Communication, No.508 Kandy Road, Dambulla",Sujeewa Communication,POINT (80.6509191 7.874519800000001)
Matale,Dambulla,"Luckystar Communication, No.457 Kurunegala Junction, Dambulla",Luckystar Communication,POINT (80.6511276 7.8746602)
Matale,Dambulla,"Mandakini Communication And Salon, No.257 Matale Road, Dambulla",Mandakini Communication And Salon,POINT (80.625168 7.465182)
Matale,Dambulla,"Nimeshi Communication And Keshakala Saloon, Trincomalee Road, Inamaluwa",Nimeshi Communication And Keshakala Saloon,POINT (80.5709849 7.8289651)
Matale,Dambulla,"CR Tailor & Communication, No - 21 , Wewala Wewa , Dambulla",CR Tailor & Communication,POINT (80.7782407 7.8859171)
Matale,Galewala,"Wihite House Communication, No.14 Kalawewa Road, Galewela",Wihite House Communication,POINT (80.57088709999999 7.7601482)
Matale,Galewala,"Lakshan Electrical And Communication, No.270 Dambulla Road, Galewela",Lakshan Electrical And Communication,POINT (80.5712442 7.7595946)
Matale,Galewala,"Chandika Communication, No.05 Matale Junction, Galewela",Chandika Communication,POINT (80.4578365 8.3307422)
Matale,Galewala,"T.R.Cellular And Phone Shop, No.22 Kurunegala Road, Galewela",T.R.Cellular And Phone Shop,POINT (80.5948607 7.789502199999999)
Matale,Galewala,"Piume Celuller, No.04 New Shoping Complex, Galewela",Piume Celuller,POINT (79.8450819 6.9273121)
Matale,Galewala,"Dilhani Communication, No.02 Matale Junction, Galewela",Dilhani Communication,POINT (80.4578365 8.3307422)
Matale,Kibissa,"Wasana Book Shop And Communication, Sigiriya Road, Kimbissa",Wasana Book Shop And Communication,POINT (80.72721079999999 7.9398336)
Matale,Kibissa,"Priyantha Agro, Sigiriya Road, Kimbissa",Priyantha Agro,POINT (80.7258683 7.939372699999999)
Matale,Kibissa,"SHANTHA COMMUNICATION, SIGIRIYA RD, KIBISSA",SHANTHA COMMUNICATION,POINT (80.7207217 7.9851855)
Matale,Matale,"SATCO LANKA TECNoLOGY, 638, MAIN ST, MATALE",SATCO LANKA TECNoLOGY,POINT (80.62295209999999 7.469020800000001)
Matale,Matale,"SUMUDU STUDIO, WELLEWELA,HATTOTA AMUNA., MATALE",SUMUDU STUDIO,POINT (80.82299119999999 7.605797)
Matale,Matale,"Mandakini Communication And Salon, No.257 Matale Road, Dambulla",Mandakini Communication And Salon,POINT (80.625168 7.465182)
Matale,Matale,"Middlesoft Communication, No.44 Kandy Road, Matale",Middlesoft Communication,POINT (80.62357159999999 7.467654400000001)
Matale,Matale,"Wajira Gift, No.24 Kumbiyangoda, Matale",Wajira Gift,POINT (80.61342719999999 7.453985899999999)
Matale,Matale,"L.G.Communication, No.752 Trincomalee Road, Matale",L.G.Communication,POINT (80.27054339999999 8.2860239)
Matale,Matale,"M.M.Stores, Pathingaskotuwa, Matale",M.M.Stores,POINT (80.61037800000001 7.5569551)
Matale,Matale,"MD COMMUNICATION, MADAWALA ULPOTHA, MATHALE",MD COMMUNICATION,POINT (80.6364875 7.6101475)
Matale,Matale,"RSK BILL CENTER, 57,SUPER MARKET COMPLEX,KING STREET, MATALE",RSK BILL CENTER,POINT (80.6228296 7.4687947)
Matale,Matale,"LAHIRU STORES, FRONT POLICE STATION, WILGAMUWA",LAHIRU STORES,POINT (80.9164957 7.5420122)
Matale,Matale,"White House, No.57 Dharmapala Mawatha, Matale",White House,POINT (80.6225183 7.4685251)
Matale,Matale,"Athula Com, Pannekaraya, Welangahawatta",Athula Com,POINT (80.65428919999999 7.8456058)
Matale,Naula,"Nimes Kal, Elahera Road, Naula",Nimes Kal,POINT (80.65688229999999 7.7065897)
Matale,Naula,"PLUS COMMUNICATION, ARANGALA JUNCTION, NAULA",PLUS COMMUNICATION,POINT (80.65204829999999 7.694939199999999)
Matale,Naula,"Ranga Comminication, Opposite The Bus Stand, Naula",Ranga Comminication,POINT (80.65308759999999 7.704501499999998)
Matale,Palapathwela,"Reehas Fancy And Communication, Matale Road, Palapathwela",Reehas Fancy And Communication,POINT (80.6257296 7.530817399999999)
Matale,Sigiriya,"New Sigiri Cafe, Main Road, Sigiriya",New Sigiri Cafe,POINT (80.75456200000001 7.9517594)
Matale,Ukuwela,"Win Win Communication, No.1 Matale Road, Ukuwela",Win Win Communication,POINT (80.6332779 7.4211307)
Matale,Ukuwela,"Nildiya Communication, Ukuwela",Nildiya Communication,POINT (80.6333719 7.421520999999999)
Matale,Ukuwela,"Sumaga Book Shop, No.6 Matale Road, Ukuwela",Sumaga Book Shop,POINT (80.63307329999999 7.421272000000001)
Monaragala,Badalkumbura,"HIRU COMMUNICATION, MAIN STREET, BADALKUMBURA, Badalkumbura",HIRU COMMUNICATION,POINT (81.23500849999999 6.8954982)
Monaragala,Badalkumbura,"NIMACO COMMUNICATION, MAIN STREET, BADALKUMBURA",NIMACO COMMUNICATION,POINT (81.2360336 6.8956857)
Monaragala,Bibile,"Sanjaya Cellular And Communication, No.11 Bus Stand, Bibile, Bibile",Sanjaya Cellular And Communication,POINT (81.22546 7.160629999999999)
Monaragala,Bibile,"AMILA VIDEO AND COMMUNICATION, BUS STANDET, DOMBAGAHAWELA, BIBILE, Bibile",AMILA VIDEO AND COMMUNICATION,POINT (81.22158999999999 7.162408999999999)
Monaragala,Buttala,"Duminda Call Center, Wellawaya Road,Burutha Junction, Buttala",Duminda Call Center,POINT (81.2167525 6.7517793)
Monaragala,Buttala,"Ranjan Video, Super Market, Buttala",Ranjan Video,POINT (81.2471054 6.759383799999999)
Monaragala,Buttala,"Sudaraka Audio & Video Centre, No 11,Shoping complex,Okkampitiya Road,Buttala",Sudaraka Audio & Video Centre,POINT (81.2569383 6.7568674)
Monaragala,Buttala,"Sathutu Call Centre, Main Street, Buttala",Sathutu Call Centre,POINT (81.24650509999999 6.7598541)
Monaragala,Buttala,"Sampath Communication and Video Centre, Kukurampola Junction,Uwa Pelwatta",Sampath Communication and Video Centre,POINT (81.20169829999999 6.7486568)
Monaragala,Kataragama,"V SISI CITY LIGHT, NANDAMITHRA MW, NEW TOWNKATARAGAMA",V SISI CITY LIGHT,POINT (79.8750476 6.8744584)
Monaragala,Kataragama,"WEERASIRI COMMUNICATION, NEW TOWN, KATARAGAMA",WEERASIRI COMMUNICATION,POINT (81.3672838 6.4051525)
Monaragala,Monaragala,"U Net Communication, Kachchcheri Handiya, Monaragala",U Net Communication,POINT (81.3384215 6.8538146)
Monaragala,Monaragala,"Sun Up Communication, No.5 New Bus Stand, Monaragala, Monaragala",Sun Up Communication,POINT (81.3516609 6.872003200000001)
Monaragala,Monaragala,"Laksiri Communication, No.03 New Bus Stand, Monaragala, Monaragala",Laksiri Communication,POINT (81.3514782 6.8717421)
Monaragala,Monaragala,"NILESHA COMMUNICATION, No 52,Bus Stand, Monaragala, Monaragala",NILESHA COMMUNICATION,POINT (81.35153099999999 6.871796799999999)
Monaragala,Monaragala,"Boralessa TechNology, No.10 Hulandawa Junction, Monaragala",Boralessa TechNology,POINT (81.338978 6.854088)
Monaragala,Monaragala,"Silva Line, 125,KUMARADOLA RD,MONARAGALA, Monaragala",Silva Line,POINT (81.35163679999999 6.874976999999999)
Monaragala,Monaragala,"Deshan Communication, Uva Kudaoya, Thanamalvila, Kudaoya",Deshan Communication,POINT (81.1228806 6.5315453)
Monaragala,Monaragala,"S NET, ETHIMALE WEWA, MONARAGALA",S NET,POINT (81.5353164 6.823358499999999)
Monaragala,Monaragala,"Pethum Communication, Infront School, Pelwatta",Pethum Communication,POINT (79.9290845 6.8927193)
Monaragala,Monaragala,"New Dayawin Phone Shop & post Off., 24,Bus Stand, MONARAGALA, MONARAGALA",New Dayawin Phone Shop & post Off.,POINT (81.3516609 6.872003200000001)
Monaragala,Monaragala,"Thilina Communication, Main Street, Thanamalwila",Thilina Communication,POINT (80.2121686 6.9515118)
Monaragala,Okkampitiya,"New Lanka Communication And Video, Main Street, Okkampitiya, Okkampitiya",New Lanka Communication And Video,POINT (80.26160159999999 6.8523761)
Monaragala,Okkampitiya,"Priyankara Book shop e communication, 65,Pothuwil Road, 20 Mile Post, Siyambalanduwa",Priyankara Book shop e communication,POINT (79.87640450000001 6.915706999999999)
Monaragala,Siyambalanduwa,"ASHAN COMMUNICATION, AMPARA RD., SIYAMBALANDUWA",ASHAN COMMUNICATION,POINT (81.6773441 7.3014215)
Monaragala,Siyambalanduwa,"Challenge Communication And Book Shop, Ampara Junction, Siyambalanduwa",Challenge Communication And Book Shop,POINT (81.55948889999999 6.9065173)
Monaragala,Siyambalanduwa,"NIROSHAN STORES, 9 MILE POST,GOVINDUPURA, MONARAGAL, Siyambalanduwa",NIROSHAN STORES,POINT (81.4763298 6.968318099999999)
Monaragala,Tanamalwila,"Manjula Communication, Uwa Kudaoya,Thanamalwila",Manjula Communication,POINT (81.12489359999999 6.5224183)
Monaragala,Tanamalwila,"Kalyani Communication, Kithulkote, Thanamalvila",Kalyani Communication,POINT (80.2127198 6.9513758)
Monaragala,Tanamalwila,"Sugeewa Communication, Main Street, Thanamalwila",Sugeewa Communication,POINT (79.913777 7.0523229)
Monaragala,Wellawaya,"Wasantha Digital Studio, No.52 Warunagama, Wellawaya",Wasantha Digital Studio,POINT (81.13415999999999 6.733776)
Monaragala,Wellawaya,"Sena Clock Technician & Video Centre, No.09,Haputhale Road,Wellawaya",Sena Clock Technician & Video Centre,POINT (80.87201639999999 6.8925034)
Monaragala,Wellawaya,"Dickwella Electricals, No.22 Haputhale Rd, Wellawaya",Dickwella Electricals,POINT (81.1013342 6.7319956)
Monaragala,Wellawaya,"Sakura Communication And Book Shop, No.55 Monaragala Rd, Wellawaya",Sakura Communication And Book Shop,POINT (81.10136989999999 6.7318074)
Monaragala,Wellawaya,"Parami Book shop & Communication, 3 Mile Post,Anapallama, Wellawaya",Parami Book shop & Communication,POINT (81.10238559999999 6.730899399999999)
Monaragala,Wellawaya,"Dakshina Communication And Phone Shop, No.18 Haputhale Road, Wellawaya",Dakshina Communication And Phone Shop,POINT (81.10157479999999 6.7320236)
Monaragala,Wellawaya,"Suhada Book Shop, Tissa Rd, Wellawaya",Suhada Book Shop,POINT (81.10238559999999 6.730899399999999)
Monaragala,Wellawaya,"W A S Communication, Haputale Road, Wellawaya",W A S Communication,POINT (81.10136989999999 6.7318074)
Monaragala,Wellawaya,"AHANGAMA COMMUNICATION, THISSA ROAD, WELLAWAYA",AHANGAMA COMMUNICATION,POINT (80.36236319999999 5.9740778)
Monaragala,Wellawaya,"Denu Video Center, No.04 Bus Stand, Wellawaya, Wellawaya",Denu Video Center,POINT (81.1022814 6.7296955)
Mulathiv,Mulathiv,"ROYAL PHONE SHOP, MULLAI ROAD, VISUVAMADU JUNCTION, VISUVAMADU, MULLAITHIVU",ROYAL PHONE SHOP,POINT (79.8406114 7.2112395)
Mulathiv,Mulathiv,"NIMALAN 3 PHONE SHOP, BEACH ROAD MULATHIVE",NIMALAN 3 PHONE SHOP,POINT (80.81591259999999 9.268268300000001)
Mulathiv,Mulathiv,"ROYAL NET CAFE, MAIN STREET,  MULLATIVE TOWNMULLATIVE",ROYAL NET CAFE,POINT (79.8663347 6.8735921)
Mulathiv,Mulathiv,"POTHIKAI BOOK SHOP, MULLATIVU ROAD, PUTHUKUDIYIRUPPU, MULLATIVU",POTHIKAI BOOK SHOP,POINT (80.6952493 9.314057199999999)
Mulathiv,Mulathiv,"NIMALAN ELECTRONIC CENTRE, BEACH ROAD, MULLATIVU, MULLATIVU",NIMALAN ELECTRONIC CENTRE,POINT (80.81591259999999 9.268268300000001)
Nuwara eliya,Bogawantalawa,"Maskeliya Stores, No.73 Main Street, Bogawanthalawa",Maskeliya Stores,POINT (80.67851449999999 6.7958786)
Nuwara eliya,Bogawantalawa,"Vinoth, No.129 Main Street, Bogawanthalawa",Vinoth,POINT (80.67568969999999 6.7972519)
Nuwara eliya,Ginigathhena,"Lotus Communication, No.64 Kandy Road, Ginigathhena",Lotus Communication,POINT (80.60556029999999 7.2349015)
Nuwara eliya,Hatton,"Telesta Communication, No.39d Danbar Road, Hatton",Telesta Communication,POINT (80.5973211 6.889699999999999)
Nuwara eliya,Hatton,"Royal Grocery, No.277 Fruit Hill, Hatton",Royal Grocery,POINT (79.90124800000001 6.9370999)
Nuwara eliya,Hatton,"S.R .Mobile, # 14, Bus Stand, Hatton",S.R .Mobile,POINT (80.598744 6.889212199999999)
Nuwara eliya,Hatton,"Ambagaspitiya Stores, Bellton Wijayabahukanda, Hatton",Ambagaspitiya Stores,POINT (80.63001229999999 7.0086098)
Nuwara eliya,Hatton,"Raasi Jewellers, No.66 Side Street, Hatton",Raasi Jewellers,POINT (80.59823779999999 6.889561199999999)
Nuwara eliya,Hatton,"Turbo Communication, Green Park Complex, * A , Danbar Rd, Hatton",Turbo Communication,POINT (80.59751100000001 6.888393499999999)
Nuwara eliya,Hatton,"Sumihiri Tea Stores, No.25 Bus Stand, Hatton",Sumihiri Tea Stores,POINT (80.65877620000001 6.938359300000001)
Nuwara eliya,Dikoya,"SUPRAMANIYAM STORES, No:09,INGASDRY,DICKOYA",SUPRAMANIYAM STORES,POINT (80.60393719999999 6.8734318)
Nuwara eliya,Kotagala,"A.B.C.Communication, No.143 Main Street, Kotagala",A.B.C.Communication,POINT (80.60883219999999 6.925175299999999)
Nuwara eliya,Labukele,"Malshan Stores, Kondagala, Labukele",Malshan Stores,POINT (80.7137479 7.0289471)
Nuwara eliya,Lindula,"SRI COMMUNICATION, FARMESTON JUNCTION, THALAWAKELE, Lindula",SRI COMMUNICATION,POINT (80.66207759999999 6.9381664)
Nuwara eliya,Norwood,"NEW SARASWATHY STORES, No;56 MAIN STREET, NoRWOOD",NEW SARASWATHY STORES,POINT (80.614035 6.836124799999999)
Nuwara eliya,Norwood,"Vigna Stores, Bogawanthalawa Road Venture, Norwood",Vigna Stores,POINT (79.5355781 17.9907202)
Nuwara eliya,Norwood,"PULIYAWATTA COMMUNICATION, 02,MAIN ST, NoRWOOD",PULIYAWATTA COMMUNICATION,POINT (80.6418346 6.8164818)
Nuwara eliya,Nuwara eliya,"PRABA JEWELS, 50/4,LAWSON STREET,NUWARA-ELIYA",PRABA JEWELS,POINT (80.7663659 6.9734636)
Nuwara eliya,Nuwara eliya,"A.G.C FANCY & COMMUNICATION, #7,BUS STAND, NUWARA ELIYA",A.G.C FANCY & COMMUNICATION,POINT (80.7654193 6.9760864)
Nuwara eliya,Nuwara eliya,"SHALIKA COMMUNICATION, 11/1,NEW BAZAAR STREET, NUWARA ELIYA",SHALIKA COMMUNICATION,POINT (80.7670141 6.9734102)
Nuwara eliya,Nuwara eliya,"AYESHA, NO:152,BUS STANDROAD,MASKELIYA",AYESHA,POINT (72.6914034 22.9416865)
Nuwara eliya,Nuwara eliya,"Udabage Stores, Udabage, Lakshapana",Udabage Stores,POINT (80.4839743 6.9262012)
Nuwara eliya,Maskeliya,"K.T.S, No:14, 7TH STREET, MASKELIYA",K.T.S,POINT (79.86386159999999 6.9198013)
Nuwara eliya,Padiyapelella,"Senaka Communication, No.29 Ragala Road, Padiyapelella",Senaka Communication,POINT (79.8533577 6.921549400000001)
Nuwara eliya,Udapussallawa,"Prasadi Communication Cd House, No.04 Post Office Road, Uda Pussellawa",Prasadi Communication Cd House,POINT (80.8595787 7.008048)
Nuwara eliya,Udapussallawa,"DISNEY , MAIN STREET, UDAPUSSELLAWA",DISNEY ,POINT (80.9041864 6.9998995)
Nuwara eliya,Walapane,"NILUSHINI COMMUNICATION, No.8,BUS STAND, WALAPANE",NILUSHINI COMMUNICATION,POINT (80.8618649 7.0949567)
Polonnaruwa,Hingurakgoda,"Swiss Furnitures, Corp City, Hingurakgoda",Swiss Furnitures,POINT (80.9549146 8.041954499999999)
Polonnaruwa,Hingurakgoda,"Shanika Communication, No.52, Hingurakgoda",Shanika Communication,POINT (80.95115699999999 8.040414699999999)
Polonnaruwa,Kaduruwela,"Cycle Bazar, Batticaloa Road, Kaduruwela",Cycle Bazar,POINT (80.62481819999999 7.4712015)
Polonnaruwa,Kaduruwela,"CEYLON MAX ENTERPRISES, HIJRA MAWARHA KADURUWELA",CEYLON MAX ENTERPRISES,POINT (79.8763354 6.9060586)
Polonnaruwa,Kaduruwela,"Royal Communication, No.1 Near The Bus Stand, Kaduruwela",Royal Communication,POINT (81.0339539 7.9287528)
Polonnaruwa,Kaduruwela,"Satco Lanka Pvt Ltd, Sowmil Junction, Kaduruwela",Satco Lanka Pvt Ltd,POINT (81.03484539999999 7.928422799999999)
Polonnaruwa,Polonnaruwa,"Chandrika Stores, Weera Place, Polonnaruwa",Chandrika Stores,POINT (81.01590499999999 7.919852199999999)
Polonnaruwa,Polonnaruwa,"THALPOTHA STORES, THALPOTHA, POLONNARUWA",THALPOTHA STORES,POINT (81.03711369999999 8.036202700000002)
Polonnaruwa,Polonnaruwa,"Priyanka Stores, New Town, Polonnaruwa",Priyanka Stores,POINT (81.0025107 7.9138917)
Polonnaruwa,Polonnaruwa,"RATHNA STORES, 54,ABAYAPURA,PULASTHIGAMA, POLONNARUWA",RATHNA STORES,POINT (81.07761379999999 8.0418939)
Polonnaruwa,Polonnaruwa,"Tele Communication, Bus Stand, Kaduruwela",Tele Communication,POINT (81.03319719999999 7.9290627)
Polonnaruwa,Polonnaruwa,"A,  MOBILE COMMUNICATION, N0, 05 POLONNARUWA ROAD , MINNERIYA",A,POINT (81.03375 7.929326)
Polonnaruwa,Polonnaruwa,"Ransiri Communication And Book Shop, Bendiwewa, Polonnaruwa",Ransiri Communication And Book Shop,POINT (81.01814089999999 7.940624499999998)
Puttalm,Anamaduwa,"Jaliya Communication, No.42 Puttalam Road, Anamaduwa",Jaliya Communication,POINT (80.0101451 7.8786038)
Puttalm,Anamaduwa,"Rantharu Communication, Welewewa, Nawagattegama",Rantharu Communication,POINT (79.8529284 7.341788600000001)
Puttalm,Dankotuwa,"Sakura Communication, No.22 Nattandiya Road, Dankotuwa",Sakura Communication,POINT (79.8825494 7.298017699999999)
Puttalm,Dankotuwa,"Sisila Mobile Centre, No.02 Super Market, Dankotuwa",Sisila Mobile Centre,POINT (79.88367099999999 7.2975477)
Puttalm,Dankotuwa,"Sanic Teleshop, No.40b Kurunegala Road, Dankotuwa",Sanic Teleshop,POINT (80.3659955 7.487804799999998)
Puttalm,Kalpitiya,"RAMZANI, MAIN STREET, KALPITIYA",RAMZANI,POINT (79.76545209999999 8.236273900000002)
Puttalm,Marawila,"SENLANKA COMMUNICATION, COLOMBO ROAD,HATTINIYA,THALWILA, MARAWILA",SENLANKA COMMUNICATION,POINT (80.04046939999999 6.2961348)
Puttalm,Mundal,"Talk Net, Puttalam Road, Mundel",Talk Net,POINT (79.82545789999999 7.8057404)
Puttalm,Nattandiya,"Kasun Textiles , 40, Marawila Rd,  Nattandiya, Nattandiya",Kasun Textiles ,POINT (79.8647836 7.410963899999999)
Puttalm,Palavi,"LAKMINI BOOK SHOP, COLOMBO ROAD, PALAVIYA",LAKMINI BOOK SHOP,POINT (79.8607868 6.9269167)
Puttalm,Puttalam,"S.T.Mobile, No.39 Kurunegala Road, Puttalam",S.T.Mobile,POINT (80.4982256 8.7542033)
Puttalm,Puttalam,"PCI COM, KARATHIV, PUTTLAM",PCI COM,POINT (79.8356704 8.030320099999999)
Puttalm,Puttalam,"P V M Electronics, No.17 K.K.Street, Puttalam",P V M Electronics,POINT (79.82969199999999 8.031699)
Puttalm,Puttalam,"A And A Communication, No.01 Shopping Complex, Puttalam",A And A Communication,POINT (79.82900169999999 8.0301837)
Puttalm,Puttalam,"NEO COMPUTERS, KALPITI ROAD, PALAKUDA, THALAWILA",NEO COMPUTERS,POINT (79.87298989999999 7.4135513)
Puttalm,Puttalam,"M K Communication, Kalpitiya Road, Mampuriya",M K Communication,POINT (79.7657207 8.2358783)
Puttalm,Puttalam,"Sanka Tele Shop, New Town, Madampe",Sanka Tele Shop,POINT (79.84078769999999 7.496739899999999)
Puttalm,Puttalam,"S & S Communication, KALPITTIYA ROAD, NURAICHCHOLAI, PUTTALAM",S & S Communication,POINT (79.89795909999999 6.795795)
Puttalm,Puttalam,"David Video Center, No.53 Hijra Mawatha Old Road, Madampe",David Video Center,POINT (79.83010999999999 7.479801900000001)
Puttalm,Puttalam,"SAMAN ELECTRONICS, CHILAW RD, PUTTLAM., Pallama",SAMAN ELECTRONICS,POINT (79.92148180000001 7.6867732)
Puttalm,Puttalam,"JOY DVD CENTER, N0.03, UC YARD, PUTTALAM",JOY DVD CENTER,POINT (79.80490449999999 7.560926599999999)
Rathnapura,Balangoda,"Dammi Communication, No.5a Bus Stand, Balangoda",Dammi Communication,POINT (80.70090549999999 6.6491908)
Rathnapura,Balangoda,"Samanala Book Shop, Pinnawala, Balangoda",Samanala Book Shop,POINT (80.6852835 6.706271300000001)
Rathnapura,Balangoda,"Reehas Fancy And Communication, Matale Road, Palapathwela",Reehas Fancy And Communication,POINT (80.6257296 7.530817399999999)
Rathnapura,Balangoda,"Pubudu Book Shop, No.62/1 Old Road Balangoda, Balangoda",Pubudu Book Shop,POINT (80.6977035 6.6491623)
Rathnapura,Balangoda,"LALITH COMMUNICATION, WELIGAPOLA, BALANGODA",LALITH COMMUNICATION,POINT (80.40943539999999 6.6816996)
Rathnapura,Belihuloya,"DOY COM COMPUTER CENTER, UNIVERSITY ROAD, PAMBAHINNA",DOY COM COMPUTER CENTER,POINT (80.78619599999999 6.716045299999999)
Rathnapura,Belihuloya,"Prasanka Communication, Galagama, Belihuloya",Prasanka Communication,POINT (80.7721971 6.7201261)
Rathnapura,Embilipitiya,"U.S.B. COM., MILE POST PANAMURA RD EMBILIPITIYA",U.S.B. COM.,POINT (80.81639989999999 6.336068)
Rathnapura,Embilipitiya,"Mal Communication, New Town, Embilipitiya",Mal Communication,POINT (80.84869499999999 6.3261229)
Rathnapura,Embilipitiya,"Bandaranayake Stores, Hospital Road New Town, Embilipitiya",Bandaranayake Stores,POINT (80.8437806 6.325821899999999)
Rathnapura,Embilipitiya,"Damith Stores, 75, 100 Mile Post, Weeraketiya Road, Embilipitiya",Damith Stores,POINT (80.87983439999999 6.297336899999999)
Rathnapura,Embilipitiya,"Cham Communication, Moraketiya Road, Embilipitiya",Cham Communication,POINT (80.19130699999999 6.934165399999999)
Rathnapura,Embilipitiya,"Silver Line Graphics And Communication, 99 Junction, Embilipitiya",Silver Line Graphics And Communication,POINT (80.8256737 6.3714067)
Rathnapura,Embilipitiya,"Sanjaya Electronic Emilipitiya, Opposite Bus Stand, Embilipityya, Embilipitiya",Sanjaya Electronic Emilipitiya,POINT (80.856042 6.33215)
Rathnapura,Embilipitiya,"Smart Mobil, No.28, Main St, Pallegama, Embilipitiya",Smart Mobil,POINT (80.8547083 6.3323242)
Rathnapura,Embilipitiya,"BANDARANAYAKA STORES., 124 MODARAWANA EMBILIPITIYA",BANDARANAYAKA STORES.,POINT (80.8437806 6.325821899999999)
Rathnapura,Godakawela,"SAVIRA COLLECTION, 60/C,MAIN ST, GODAKAWELA",SAVIRA COLLECTION,POINT (80.65778399999999 6.501995)
Rathnapura,Godakawela,"SIHINA COM., MAIN STREET GODAKAWELA",SIHINA COM.,POINT (80.6508413 6.5045383)
Rathnapura,Kahawatta,"FLOWER SHOP, MAIN STREET, KAHAWATTA",FLOWER SHOP,POINT (80.61032809999999 6.6060075)
Rathnapura,Kalawana,"Phone House Communication, No.10 Manana, Kalawana",Phone House Communication,POINT (80.3967583 6.5318206)
Rathnapura,Kalawana,"U Tec Communication, Pothupitiya, Kalawan",U Tec Communication,POINT (79.90139189999999 6.796456500000001)
Rathnapura,Kuruwita,"SEUWANDI COM., MAIN STREET NERA THE POLICE KURUWITA, na",SEUWANDI COM.,POINT (80.364712 6.7788391)
Rathnapura,Kuruwita,"NEW ISURU COM, PARADISE KURUWITA, na, Paradise",NEW ISURU COM,POINT (80.36977739999999 6.758481)
Rathnapura,Kuruwita,"Paradise Communication, Paradise Junction, Kuruwita",Paradise Communication,POINT (80.37124159999999 6.7652569)
Rathnapura,Kuruwita,"SHOI COM, HIGGASHENA KURUWITA., na",SHOI COM,POINT (80.1549965 7.198353300000001)
Rathnapura,Kuruwita,"SILVA STORES & COMM, HIGGASHENA, KURUWITA",SILVA STORES & COMM,POINT (80.36854989999999 6.7584236)
Rathnapura,Kuruwita,"Rasan Cellular, Colombo Road, Kuruwita",Rasan Cellular,POINT (80.3682879 6.773597400000001)
Rathnapura,Kuruwita,"S.J.Electronics, No.22 Arathna Road, Kuruvita",S.J.Electronics,POINT (80.3668038 6.777232199999999)
Rathnapura,Kuruwita,"High Communication, No.63/A Colombo Road, Kuruwita",High Communication,POINT (80.3646646 6.7783383)
Rathnapura,Nivithigala,"NEW WIN MIN COM, KALAWANA ROAD, NIVITHIGALA",NEW WIN MIN COM,POINT (79.8447204 6.9356673)
Rathnapura,Nivithigala,"Maya Communication, No.12 Kalawana Road, Nivithigala",Maya Communication,POINT (80.457745 6.596132799999999)
Rathnapura,Opanayaka,"NILMINI COMMUNICATION, UDAWELLA, OPANAYAKA",NILMINI COMMUNICATION,POINT (80.5448638 5.9490067)
Rathnapura,Opanayaka,"Chamil Communication, No.04a Main Street, Opanayake",Chamil Communication,POINT (80.6209164 6.608792999999999)
