District,City,Address,outlet_name,store_location
Colombo,Colombo,"RUWAN TRADE CENTER, 180/101,PEOPLE'S PARK,, COL.11",RUWAN TRADE CENTER,POINT (79.85420409999999 6.9364683)
Colombo,Dehiwala,"Nihal Communication, No.3C,Station Road, Dehiwala",Nihal Communication,POINT (79.8657089 6.851152099999999)
Colombo,Dehiwala,"Rivisandu, No.368/A Hospital Rd, Kalubowila",Rivisandu,POINT (79.8743302 6.8657757)
Colombo,Dehiwala,"Perferc Ads, No.30c S.D.E.S.Jayasinghe Road, Kalubowila",Perferc Ads,POINT (79.8804038 6.871975700000001)
Colombo,Dehiwala,"C.M.H.Com, No.81B, Saranankara Rd, Kalubowila , Dehiwala",C.M.H.Com,POINT (79.8675738 6.8714512)
Colombo,Dehiwala,"PIUMI GROCERIES, NO.53/A,PEIRIS AVENUE,KALUBOWILA,, DEHIWALA",PIUMI GROCERIES,POINT (79.87678509999999 6.8633153)
Colombo,Dehiwala,"Dilu Communication, No.35 A Galle Road, Dehiwala",Dilu Communication,POINT (79.8643196 6.8607292)
Colombo,Dehiwala,"Vj Communications And Cafe, No.163c Hospital Road, Kalubowila",Vj Communications And Cafe,POINT (79.8759376 6.8662769)
Colombo,Dehiwala,"G&D Com, 102/d attidiya Rd, Dehiwala",G&D Com,POINT (79.8858675 6.836982)
Colombo,Hanwella,"Lakmali Communication, Highlevel Road Pahathgama, Hanwella",Lakmali Communication,POINT (80.08781309999999 6.9017373)
Colombo,Hanwella,"COLOURMIX, 43 1/1, MAIN STREET, HANWALLA",COLOURMIX,POINT (79.79659629999999 7.583079699999999)
Colombo,Hanwella,"CHINTHAKA STORES, 217/A THUNNANA, HANWELLA",CHINTHAKA STORES,POINT (80.0033772 6.841921999999999)
Colombo,Hanwella,"Edirisinghe Communication, Near The Temple Highlevel Road Thunnana, Hanwella",Edirisinghe Communication,POINT (80.0878372 6.8866894)
Colombo,Hanwella,"THE PRINT SHOP, SUPER MARKAT,, HANWELLA",THE PRINT SHOP,POINT (80.0808736 6.908809499999999)
Colombo,Hanwella,"SARANGA ELECTRICALS AND TRADERS, No 193/A, wanahagoda Hanwella",SARANGA ELECTRICALS AND TRADERS,POINT (80.08124339999999 6.9086774)
Colombo,Hokandara,"J.P.COMMUNICATION, 79/B2,HOKANDARA EAST, HOKANDARA",J.P.COMMUNICATION,POINT (79.9691145 6.8772712)
Colombo,Homagama,"ARUNALU BOOK SHOP, 101/1A SHCOOL JANGTION PITIPANA NoRT, HOMAGAMA",ARUNALU BOOK SHOP,POINT (80.02202419999999 6.840482499999999)
Colombo,Homagama,"GALAGEDARA COMMUNICATION, 82,PITIPANA NoRTH,HOMAGAMA",GALAGEDARA COMMUNICATION,POINT (80.0265744 6.827907)
Colombo,Homagama,"Exceed Communication And Video Centre, No.211/10 Katuwana Road, Homagama",Exceed Communication And Video Centre,POINT (80.0036918 6.828408100000001)
Colombo,Homagama,"Jayasooriya Book Shop And Communication, No.299 Magammana, Homagama",Jayasooriya Book Shop And Communication,POINT (80.0000371 6.8493137)
Colombo,Homagama,"Gayara Communication, No.1 Super Market, Homagama",Gayara Communication,POINT (80.00408259999999 6.8415997)
Colombo,Homagama,"Vista Communication, No.96/A Station Road, Homagama",Vista Communication,POINT (79.97488709999999 6.8116641)
Colombo,Homagama,"Enuri Communication, No.35 Pitipana Town Highlevel Road, Homagama",Enuri Communication,POINT (80.0187129 6.8482694)
Colombo,Homagama,"Risaja Enterprises, No.1 Super Market, Homagama",Risaja Enterprises,POINT (80.00513200000002 6.8413315)
Colombo,Homagama,"Wave GSM, No 22/A, Katuwana Rd, Homagama",Wave GSM,POINT (80.00289339999999 6.8400987)
Colombo,Homagama,"Jeewani Book Shop, No.212 Galawilawatta Highlevel Road, Homagama",Jeewani Book Shop,POINT (80.0028042 6.8410458)
Colombo,Homagama,"Thilina Communication, No.45 Katuwana Road, Homagama",Thilina Communication,POINT (80.00313799999999 6.840641799999999)
Colombo,Homagama,"Chathuries Book Shop And Communication, No.65 Katuwana Road, Homagama",Chathuries Book Shop And Communication,POINT (80.0031163 6.8404542)
Colombo,Homagama,"EXPERT, 31, STATION RD, HOMAGAMA",EXPERT,POINT (80.0032286 6.842060500000001)
Colombo,Homagama,"Gate Way Gsm And Communication, No.428 Highlevel Road, Homagama",Gate Way Gsm And Communication,POINT (80.0325357 6.8517966)
Colombo,Homagama,"Sisina Communication, No.09 Highlevel Road, Homagama",Sisina Communication,POINT (80.0027851 6.8411646)
Colombo,Homagama,"Hot Line Cellular, No.27 Katuwana Road, Homagama",Hot Line Cellular,POINT (80.00610519999999 6.833081399999999)
Colombo,Homagama,"DAVID PLAZA, 786,HIGHLEVEL RD, HOMAGAMA",DAVID PLAZA,POINT (80.0195219 6.8479779)
Colombo,Homagama,"Thanuja Book Shop, Abarawatha Mawatha, Pitipana, Homagama",Thanuja Book Shop,POINT (80.0184663 6.8444093)
Colombo,Homagama,"ONWELL COMMUNICATION, NO:307/1,MEEGASMULLA,PANAGODA, HOMAGAMA",ONWELL COMMUNICATION,POINT (80.02732400000001 6.874960000000001)
Colombo,Homagama,"Nenawaruna Book Shop, No.187 Highlevel Road Galawilawatta, Homagama",Nenawaruna Book Shop,POINT (79.9913655 6.8394514)
Colombo,Homagama,"Kmg Communication, No.25 Athurugiriya Road, Homagama",Kmg Communication,POINT (79.96991460000001 6.844563399999999)
Colombo,Homagama,"PARAMEE BOOK SHOP, 607/10/C, PITIPANA TOWN, HOMAGAMA",PARAMEE BOOK SHOP,POINT (80.2620833 7.234631299999999)
Colombo,Homagama,"Vidushan Communication, No.114/C Highlevel Road, Homagama",Vidushan Communication,POINT (80.006012 6.8423285)
Colombo,Kaduwela,"St.Marys Communication, No.05 Welivita, Kaduwela",St.Marys Communication,POINT (79.9617224 6.9357064)
Colombo,Kaduwela,"LAHIRU COMMUNICATION, 83,EMBULGAMA, RANALA",LAHIRU COMMUNICATION,POINT (79.96807489999999 6.8027557)
Colombo,Kaduwela,"SELAS ELECTRICALS & LIGHTFITTIN, 139/C NEW KANDY ROADKOTHALAWALA, KADUWELA",SELAS ELECTRICALS & LIGHTFITTIN,POINT (79.9722311 6.9128456)
Colombo,Kesbewa,"Chamara Book Shop, Kesbewa Road,Bandaragama",Chamara Book Shop,POINT (79.9887614 6.7144786)
Colombo,Kolonnawa,"Diwijaya Book Shop And Communication, No.69 Kolonnawa Road, Kolonnawa",Diwijaya Book Shop And Communication,POINT (79.9235262 6.9169)
Colombo,Kolpitty,"Nasa Com., No:07,School Lane, Colombo 03",Nasa Com.,POINT (79.85481249999999 6.896198099999999)
Colombo,Kolpitty,"Mobi World, 505, Galle Rd, Colombo 3",Mobi World,POINT (79.8511063 6.9119458)
Colombo,Kosgama.,"ICom Cpmmunication, 375/D, High Level Rd, Boralugoda, Kosgama",ICom Cpmmunication,POINT (79.9660294 6.8084998)
Colombo,Kotikawatta,"TERANCE COMMUNICATION, 107/1,KOTIKAWATTA,ANGODA",TERANCE COMMUNICATION,POINT (79.9165273 6.9300145)
Colombo,Kottawa,"BOOK SHOP, No.1009/5, ""SAMPATH"" Liyanagoda Rd, KatukurundaKottawa",BOOK SHOP,POINT (79.99885519999999 6.6616146)
Colombo,Kottawa,"Neranja Communication, 1624/1, Malabe Road, Kottawa, Pannipitiya",Neranja Communication,POINT (79.96902489999999 6.8488922)
Colombo,Kottawa,"AMARASINGHE STORES, 457,KOTTAWA, PANNIPITIYA",AMARASINGHE STORES,POINT (79.95558459999999 6.8452464)
Colombo,Kottawa,"Thilini Book Shop, No.617/1/2 Erewwala, Pannipitiya",Thilini Book Shop,POINT (79.93709579999999 6.819952499999999)
Colombo,Kottawa,"Asha Stores, No.27/A5o Rukmalgama, Kottawa",Asha Stores,POINT (79.8704036 6.8646413)
Colombo,Kottawa,"KOTTAWA GROCERRY & COMMUNICATION, KOTTAWA JUNCTION, KOTTAWA",KOTTAWA GROCERRY & COMMUNICATION,POINT (79.96475339999999 6.841949199999999)
Colombo,Kottawa,"GAGANA COMM, DIGANA JUNCTON PALANWATTA, PANNIPITIYA",GAGANA COMM,POINT (79.96173019999999 6.8298785)
Colombo,Kottawa,"MANJULA COMMUNICATION, 147/1/A, HIRIPITIYA, PANNIPITIYA",MANJULA COMMUNICATION,POINT (79.9654324 6.8411652)
Colombo,Kottawa,"RAN HIRU BOOK SHOP, 1180/2A, MALABE ROAD, KOTTAWA, PANNIPITIYA",RAN HIRU BOOK SHOP,POINT (79.9590918 6.8443076)
Colombo,Kottawa,"MANOJ COMMUNICATION, NO:40B, MABULGODA, PANNIPITIYA",MANOJ COMMUNICATION,POINT (79.9553011 6.8433199)
Colombo,Kottawa,"KUMARA ELECTRONICS, 196/2, HIRIPITIYA, PANNIPITIYA",KUMARA ELECTRONICS,POINT (79.98106079999999 6.8337419)
Colombo,Kottawa,"Hiru Communication, No.193/7/2, Mattegoda",Hiru Communication,POINT (79.97419169999999 6.813627599999999)
Colombo,Kottawa,"Laxmi Stores, NO.99,NIYANDAGALA, PANNIPITIYA",Laxmi Stores,POINT (79.9529912 6.8491107)
Colombo,Kotte,"Jinidu Communication, No.28 Rajamaha Viharaya Rd Mirihana, Kotte",Jinidu Communication,POINT (79.9047511 6.881028199999999)
Colombo,Kotte,"E-Jay Communication, No.17/A, Mahindarama Rd,, Sri Jayawardenapura Kotte",E-Jay Communication,POINT (79.9070303 6.898108799999999)
Colombo,Kotte,"Eagle Communication, No.889 Kotte Road Ethul Kotte, Kotte",Eagle Communication,POINT (79.90510639999999 6.9032721)
Colombo,Kotte,"EAGLE COMMUNICATION, NO.885/B,KOTTE RD,, ETHUL KOTTE",EAGLE COMMUNICATION,POINT (79.90510639999999 6.9032721)
Colombo,Kotte,"Akeesa Communication, Thalawathugoda Road Madiwela, Kotte",Akeesa Communication,POINT (79.94076729999999 6.8697618)
Colombo,Maharagama,"Jayasri Communication, No.157/A Dehiwala Road, Maharagama",Jayasri Communication,POINT (79.9340813 6.8488726)
Colombo,Maharagama,"Duke Communication, No.35 Old Road, Maharagama",Duke Communication,POINT (79.92778939999999 6.8462673)
Colombo,Maharagama,"WARNA COMMUNICATION, No 186A, HIGHLEVEL ROAD, MAHARAGAMA",WARNA COMMUNICATION,POINT (79.9259797 6.848049899999999)
Colombo,Maharagama,"globel communication, 159,Dehiwala road, Maharagama",globel communication,POINT (79.92546660000001 6.8446753)
Colombo,Maharagama,"Waruna Communication, No.192 Highlevel Road, Maharagama",Waruna Communication,POINT (79.9213749 6.851140699999999)
Colombo,Maharagama,"Daya Communication, No.157 Highlevel Road, Maharagama",Daya Communication,POINT (79.9259366 6.8439108)
Colombo,Maharagama,"MAHRAGAMA HARDWARE, 1/7, ANANDA MAITHRI MW, MAHARAGAMA",MAHRAGAMA HARDWARE,POINT (79.93515889999999 6.8316569)
Colombo,Maharagama,"Nethmini Video, Janatha Road Wattegedara, Maharagama",Nethmini Video,POINT (79.9219044 6.850821799999999)
Colombo,Maharagama,"Metro Communication, No.269/A, Pamunuwa",Metro Communication,POINT (79.9280139 6.8566765)
Colombo,Maharagama,"Y Com Communication, No.171 A Pamunuwa Road, Maharagama",Y Com Communication,POINT (79.9280668 6.8521782)
Colombo,Maharagama,"Voltage Com, No.159 Highlevel Road, Maharagama",Voltage Com,POINT (79.92245699999999 6.850126599999999)
Colombo,Maharagama,"Shan Vedio And Communication, No.201a Pamunuwa Road, Maharagama",Shan Vedio And Communication,POINT (79.92768699999999 6.8530387)
Colombo,Maharagama,"SITHUM COMMUNICATION, 50/1, HIGHLEVEL ROAD, MAHARAGAMA",SITHUM COMMUNICATION,POINT (79.9245782 6.848691499999999)
Colombo,Maharagama,"K.D.S.BANDARA SOMASIRI(FREELANCE), 120 A,HIGH LEVEL RD, MAHARAGAMA",K.D.S.BANDARA SOMASIRI(FREELANCE),POINT (79.9238842 6.8496134)
Colombo,Maharagama,"G P Cellular And Communication, No.12 Rajamahavihara Road Navinna, Maharagama",G P Cellular And Communication,POINT (79.91307639999999 6.854665199999999)
Colombo,Malabe,"P C TECHNOLOGY, 45 THLAHENA , MALABE",P C TECHNOLOGY,POINT (79.9670273 6.913515299999999)
Colombo,Malabe,"SAKIN COMMUNICATION, NO,172/2,WELIWITA, MALABE",SAKIN COMMUNICATION,POINT (79.97189639999999 6.915701599999999)
Colombo,Malabe,"Liyanage Stores, No.560/A Mihindu Mawatha, Malabe",Liyanage Stores,POINT (79.9643607 6.897512099999999)
Colombo,Malabe,"Sonic Music Corner, No.831/2d Bus Stand, Malambe",Sonic Music Corner,POINT (79.9545368 6.9038539)
Colombo,Maradana,"ARUNALU COMMUNICATION, No.463 A,MARADANA RD, COLOMBO-10",ARUNALU COMMUNICATION,POINT (79.8533577 6.921549400000001)
Colombo,Maradana,"Gunasiri Industries, No.865 Maradana Road Punchi Borella, Colombo 10",Gunasiri Industries,POINT (79.87074299999999 6.922076)
Colombo,Maradana,"NET CITY COMMUNICATION, No.435,2ND DIVISION,MARADANA, COLOMBO 10",NET CITY COMMUNICATION,POINT (79.8656089 6.9272771)
Colombo,Maradana,"Euraka S Shoe Palace, No.455 And 457 2nd Division Maradana Road, Colombo 10",Euraka S Shoe Palace,POINT (79.8658655 6.9271579)
Colombo,Meepe,"Pavithra Stores, No.179 Meepe Junction",Pavithra Stores,POINT (80.09057120000001 6.8607187)
Colombo,Meegoda,"YASIRU PHARMACY, 106, PADUKKA ROAD, MEEGODA",YASIRU PHARMACY,POINT (79.9872831 6.9413223)
Colombo,Meegoda,"SATHSARA COMMUNICATION, 115/8, PUWAK WATHTHA ROAD",SATHSARA COMMUNICATION,POINT (80.3671701 7.5921862)
Colombo,Moratuwa,"Nishani Electronic, No.49 Galle Road, Moratuwa",Nishani Electronic,POINT (80.0543673 6.236667499999999)
Colombo,Moratuwa,"Sun Way Gsm, No.608 Galle Rd Rawatawatta, Moratuwa",Sun Way Gsm,POINT (79.8845395 6.786982999999999)
Colombo,Moratuwa,"G.C.Communication, NO :214,Molpe Rd, Katubedda, Moratuwa",G.C.Communication,POINT (79.90067719999999 6.7946792)
Colombo,Moratuwa,"Watch Center, No.19 Ihala Indibedda, Moratuwa",Watch Center,POINT (79.89827790000001 6.778813899999999)
Colombo,Moratuwa,"Sha Multy Center, No.48 Ihala Indibedda, Moratuwa",Sha Multy Center,POINT (79.89693439999999 6.7808724)
Colombo,Moratuwa,"Indibedda Watch Center, No.19 Upper Indibedda, Moratuwa",Indibedda Watch Center,POINT (79.89827790000001 6.778813899999999)
Colombo,Moratuwa,"Sri Hemali Communication, No.213 De Soysa Rd Moratumulla, Moratuwa",Sri Hemali Communication,POINT (79.89534929999999 6.7880237)
Colombo,Moratuwa,"SAMPATH STORES, 40. PUWAKARABA, KADALANA, , MORATUWA",SAMPATH STORES,POINT (79.8943385 6.782934699999999)
Colombo,Moratuwa,"D.S. Book Centre, No.87 St.Anthonys Road Kadalana, Moratuwa",D.S. Book Centre,POINT (79.88264889999999 6.774555899999999)
Colombo,Moratuwa,"Yuran Phone Shop, No.172 New Galle Rd Egoda Uyana, Moratuwa",Yuran Phone Shop,POINT (79.8845395 6.786982999999999)
Colombo,Mount lavenia,"Nr Communication, No.101b Templers Road, Mount Lavinia",Nr Communication,POINT (79.8733972 6.831662)
Colombo,Mount lavenia,"Malaka Book Shop And Com, No.80A Temple Rd, Mt.Lavinia",Malaka Book Shop And Com,POINT (79.8746541 6.8317136)
Colombo,Nawala,"I Play Communication, 34/6, Nawala Road, Narahenpita, Colombo 05",I Play Communication,POINT (79.88035259999999 6.889193799999999)
Colombo,Nugegoda,"EXCEL COMMUNICATION, 02, SRI SORATHA MW., WIJEARAMA, NUGEGODA",EXCEL COMMUNICATION,POINT (79.90763729999999 6.855394599999999)
Colombo,Nugegoda,"Ex - Touch, No.705/B Wijerama Gangodawila, Nugegoda",Ex - Touch,POINT (79.9082281 6.8578334)
Colombo,Nugegoda,"N.I.SIRISENA, NO.169/A,OLD KOTTAWA RD,MIRIHANA,, NUGEGODA",N.I.SIRISENA,POINT (79.905911 6.8716323)
Colombo,Nugegoda,"Panasara Com, Soratha Mw, Gangodawila,, Nugegoda",Panasara Com,POINT (79.9083043 6.8577055)
Colombo,Padukka,"Dasatha Communication And Book Shop, No.147/B Meepe Junction, Padukka",Dasatha Communication And Book Shop,POINT (80.090959 6.8579895)
Colombo,Padukka,"CHAYA COMMUNICATION, 23, COLOMBO ROAD, PADUKKA",CHAYA COMMUNICATION,POINT (80.09137330000001 6.841596699999999)
Colombo,Padukka,"Isuru Book Shop, No.196 Arukwatta, Padukka",Isuru Book Shop,POINT (80.10073989999999 6.8422803)
Colombo,Piliyandala,"Desmeridian, No.278 Moratuwa Rd Suwarapola, Piliyandala, piliyandala",Desmeridian,POINT (79.9126455 6.797950699999999)
Colombo,Piliyandala,"Sanwa Lal Enterpraises, No.66 Saranapala Mawatha, Piliyandala, Piliyanda",Sanwa Lal Enterpraises,POINT (79.92363 6.80244)
Colombo,Piliyandala,"Nimsara Mobile Phone Center, No.165, Colombo RD, Bokundara, Piliyandala",Nimsara Mobile Phone Center,POINT (79.9177966 6.818267)
Colombo,Piliyandala,"Reshon Book Shop & Communication, No.4,     1st  Street, Piliyandala., Piliyandala",Reshon Book Shop & Communication,POINT (79.94353509999999 6.779619500000001)
Colombo,Piliyandala,"Thilakshi Communication, No.107 Suwarapola, Piliyandala, Piliyandala",Thilakshi Communication,POINT (79.9119661 6.7976605)
Colombo,Piliyandala,"Sarasi Book Shop And Com, No.35/A Horana Road, Piliyandala, Piliyandala",Sarasi Book Shop And Com,POINT (79.94215659999999 6.7947899)
Colombo,Piliyandala,"City Communication, No.299 Miriswatta, Piliyandala",City Communication,POINT (79.9309081 6.797294)
Colombo,Piliyandala,"AS VIDEO CENTRE, 114,MAKANDANA, MADAPATHA",AS VIDEO CENTRE,POINT (79.93818589999999 6.775414899999999)
Colombo,Piliyandala,"Deshapriya Communication, Ihala Bope",Deshapriya Communication,POINT (80.09140959999999 6.8426627)
Colombo,Piliyandala,"MADU COMMUNICATION, 47, GORAKAPITIYA, PILIYANDALA",MADU COMMUNICATION,POINT (79.94908000000001 6.8161657)
Colombo,Piliyandala,"KAVIDU GROCERY, 352, LAKE ROAD, BORALASGAMUWA",KAVIDU GROCERY,POINT (79.9201624 6.828358199999999)
Colombo,Piliyandala,"MULTIVISION ENTERTAINMENT, 57/G, HORANA ROADKESBEWA, PILIYANDALA",MULTIVISION ENTERTAINMENT,POINT (79.92323949999999 6.8012062)
Colombo,Piliyandala,"Purasanda Book Shop, No.311/A Jambugasmulla Junction, Kiriwattuduwa",Purasanda Book Shop,POINT (79.87745719999999 6.9304554)
Colombo,Piliyandala,"Ronit Computers, Thalagala, Kiriwattuduwa",Ronit Computers,POINT (80.01922999999999 6.8436086)
Colombo,Piliyandala,"T.C.R SOLUTION, 32-2-2,KOTTAWA ROAD,MAWITTARA,PILIYANDALA",T.C.R SOLUTION,POINT (79.94080169999999 6.8038546)
Colombo,Piliyandala,"Sampath Communication, No.85a Madapatha Road Kolamunna, Piliyandala, Piliyandala",Sampath Communication,POINT (79.92313729999999 6.8007712)
Colombo,Piliyandala,"SUREN COMMUNICATION, 52,MADAPATHA ROAD, KOLAMUNNA, PILIYANDALA, PILIYANDALA",SUREN COMMUNICATION,POINT (79.92313729999999 6.8007712)
Colombo,Piliyandala,"LAKMUTHU BOOK SHOP, 41/4, MADAPATHA, PILIYANDALA, PILIYANDALA",LAKMUTHU BOOK SHOP,POINT (79.9306292 6.7665539)
Colombo,Piliyandala,"Sarasi Book Shop, No.22 Colombo Road, Piliyandala, Piliyandala",Sarasi Book Shop,POINT (79.94215659999999 6.7947899)
Colombo,Piliyandala,"Swarna Communication, No.648 Bokundara, Piliyandala, Piliyandala",Swarna Communication,POINT (79.9177966 6.818267)
Colombo,Piliyandala,"Kushani Studio, No.185 Horana Road, Piliyandala, Piliyandala",Kushani Studio,POINT (79.9255034 6.799610599999999)
Colombo,Piliyandala,"Pannila Stores, No.162/1/13a Kahapola, Madapatha, Madapatha",Pannila Stores,POINT (79.9312288 6.7556658)
Colombo,Piliyandala,"Madhusha Comminication And Bookshop, No.577 Lake Road, Boralesgamuwa",Madhusha Comminication And Bookshop,POINT (79.9082878 6.842117399999999)
Colombo,Polgasovita,"K.DESITHA STORES, NO.258 B/2,HORANA RD, KAHATHUDUWA., Polgasovita",K.DESITHA STORES,POINT (79.93709579999999 6.819952499999999)
Colombo,Polgasovita,"SANOLTA BOOK SHOP, NO 169/D , HORANA ROAD, WETHARA, Polgasovita",SANOLTA BOOK SHOP,POINT (80.0344145 6.726088799999999)
Colombo,Polgasovita,"Laxman Stores, 66/21, Wethara, Polgasovita",Laxman Stores,POINT (79.8651656 6.931749099999999)
Colombo,Pita Kotte,"Jithro Book Shop, No.137/A Thalawatugoda Road Beddagana Pitakotte, Kotte",Jithro Book Shop,POINT (79.9337215 6.874937399999999)
Colombo,Wellawatta,"SING TEL, 107/D, GALLE ROAD, WELLAWATTA,COLOMBO 06",SING TEL,POINT (79.86108469999999 6.874727000000001)
Colombo,Wellawatta,"E.Solution System, No.4c1 Fussels Lane, Wellawatta",E.Solution System,POINT (79.86174919999999 6.8736893)
Colombo,Wellampitiya,"Nethmi Book Shop And Communication, No.218 Brandiyawatta, Wellampitiya",Nethmi Book Shop And Communication,POINT (79.90383199999999 6.9367987)
Galle,Elpitiya,"D.M.G.Communication, No.2 Super Market Complex, Elpitiya",D.M.G.Communication,POINT (80.0536408 6.2417748)
Galle,Elpitiya,"Lihini Gift Center, No.91 Main Street, Elpitiya",Lihini Gift Center,POINT (80.1634746 6.2920013)
Galle,Elpitiya,"Linara Fashion, No.15 Aluthgama Road, Elpitiya",Linara Fashion,POINT (80.1637676 6.293044)
Galle,Ambalangoda,"Hemasiri Enterprises, No.39e Galle Road, Ambalangoda",Hemasiri Enterprises,POINT (80.17268729999999 6.0646855)
Galle,Ambalangoda,"Namal Traders, No.114/C Galle Road, Ambalangoda",Namal Traders,POINT (80.0519795 6.2339429)
Galle,Ambalangoda,"A.S.Silva Com, No.37/A Elpitiya Road, Ambalangoda",A.S.Silva Com,POINT (80.05353749999999 6.2410127)
Galle,Baddegama,"Saniska Book Shop And Communication, Baddegama",Saniska Book Shop And Communication,POINT (80.17793469999999 6.1723127)
Galle,Baddegama,"Dhamith Cellular World, No.68c Galle Road, Baddegama",Dhamith Cellular World,POINT (80.2095235 6.0507249)
Galle,Baddegama,"Studio Liberty, Baddegama",Studio Liberty,POINT (80.1792715 6.1691383)
Galle,Baddegama,"Eminense .Com, Sandarawala Junction, Baddegama",Eminense .Com,POINT (80.1837876 6.1549824)
Galle,Baddegama,"WASANA GRAFIC, SANDARAWALA, BADDEGAMA",WASANA GRAFIC,POINT (80.1837245 6.1544291)
Galle,Balapitiya,"S.K. Communication, No.5 Main Street, Balapitiya",S.K. Communication,POINT (79.91547199999999 6.9276366)
Galle,Bentota,"Sumee Book Shop And Communication, Gonagalapura, Benthota",Sumee Book Shop And Communication,POINT (79.8774428 6.961417099999999)
Galle,Bentota,"Palitha Tailors And Communication, Miriswatta, Benthota",Palitha Tailors And Communication,POINT (79.99963049999999 6.429569)
Galle,Dodanduwa,"Chami Cellular Phone Center, No.28 Kumara Kanda, Dodanduwa",Chami Cellular Phone Center,POINT (79.8898835 6.872341599999999)
Galle,Dodanduwa,"Nandika Communication, No.47 Galle Road Kumarakanda, Dodanduwa",Nandika Communication,POINT (80.1252866 6.110365499999999)
Galle,Galle,"GALLE COMMUNICATION, HAVELOCK RD, GALLE",GALLE COMMUNICATION,POINT (80.21504299999999 6.0334059)
Galle,Galle,"Amila Book Shop, 10th Mile Post Akuressa Road, Opatha",Amila Book Shop,POINT (80.60542270000001 6.323059)
Galle,Galle,"Arrow Communication, Opposite Plywood Factory, Ginthota",Arrow Communication,POINT (83.29995249999999 17.7352775)
Galle,Galle,"Ruwan Communication And Video Center, Elpitiya Road Mahaedanda, Karandeniya",Ruwan Communication And Video Center,POINT (80.04046939999999 6.2961348)
Galle,Galle,"Manjula Book Shop And Communication, No.11 New Shopping Complex Mahaedanda, Karandeniya",Manjula Book Shop And Communication,POINT (80.09318759999999 6.2709112)
Galle,Galle,"DESANDU ELECTRONICS, MAPALAGAMA ROAD,MATTAKA, GALLE",DESANDU ELECTRONICS,POINT (80.2487136 6.308144)
Galle,Galle,"SHANTHI VIDEO, THANABADEGAMA, ETHKADUWA",SHANTHI VIDEO,POINT (80.0405243 6.5235362)
Galle,Galle,"Naveen Communication, Atakohota, Nawadagala",Naveen Communication,POINT (80.1358712 6.3197929)
Galle,Galle,"SHANTHA COMMUNICATION, BUS STAND, AVTIHTHTEWA",SHANTHA COMMUNICATION,POINT (78.14616869999999 8.8050315)
Galle,Galle,"A.B.R.World, No.57 Thakkiya Rd Thalapitiya, Galle",A.B.R.World,POINT (80.2249089 6.0404254)
Galle,Galle,"J.D.K COMMUNICATION, 394/A,WAKWELLA ROAD,KALEGANA, GALLE",J.D.K COMMUNICATION,POINT (80.2039611 6.058743799999999)
Galle,Galle,"CHAMARA STORES , THALAWA, WADURAMBA",CHAMARA STORES ,POINT (80.29110709999999 6.1387303)
Galle,Galle,"P.L.D AIRANI , WACKWELLA RD,HAPUGALA, GALLE",P.L.D AIRANI ,POINT (80.19838159999999 6.070075399999999)
Galle,Galle,"Dilini Com, Batapola Rd, Kahawa",Dilini Com,POINT (80.1167464 6.2256088)
Galle,Galle,"A.R.Computers, Ginimellagaha Junction, Ginimellagaha",A.R.Computers,POINT (79.97844909999999 6.4548682)
Galle,Galle,"ISHAN GRAPHIC, GULUGAHA JUNTION,GONAPINUWALA, GALLE",ISHAN GRAPHIC,POINT (80.1399648 6.1498487)
Galle,Galle,"MOBILE TEC, BADDEGAMA RD, GONAPINUWALA, na",MOBILE TEC,POINT (80.1749267 6.1632895)
Galle,Galle,"Surek Photo, Pollewwa, Batapola",Surek Photo,POINT (80.1146308 6.224787399999999)
Galle,Galle,"She And He Mobile Shop, No.399a Wackwella Road, Julgaha",She And He Mobile Shop,POINT (80.2153766 6.0333605)
Galle,Galle,"ISURU VIDEO, KAILATHTHA,, URAGASMAHANDIYA",ISURU VIDEO,POINT (79.934146 6.844468)
Galle,Galle,"Ananda Grocery, No.125 Bandaranayake Place, Galle",Ananda Grocery,POINT (79.8581909 6.8837988)
Galle,Galle,"Varuna Phone Shop, N/A, N/A",Varuna Phone Shop,POINT (80.2287702 6.0410737)
Galle,Galle,"Sanhinda Book Shop, Thalagaha Junction, Akmeemana",Sanhinda Book Shop,POINT (80.2485626 6.077833399999999)
Galle,Galle,"D.U.T. Communication, Overkanda, Rathgama",D.U.T. Communication,POINT (80.136588 6.0942707)
Galle,Galle,"SRIPALE CENTER, UDUVILA , BATAPOLA",SRIPALE CENTER,POINT (80.11806539999999 6.2238404)
Galle,Habaraduwa,"Sala Phone Shop, Dikkumbura Road, Habaraduwa",Sala Phone Shop,POINT (80.3083125 5.9949375)
Galle,Habaraduwa,"Sinali Enterprises, No.12 Galle Road, Habaraduwa",Sinali Enterprises,POINT (80.3057896 5.9937983)
Galle,Habaraduwa,"Ranjan Stores, Kadapilawatta, Habaraduwa",Ranjan Stores,POINT (79.8652142 6.9167258)
Galle,Hikkaduwa,"C Net, Hikkaduwa East Gonapinuwala, Hikkaduwa",C Net,POINT (80.10089929999999 6.1314898)
Galle,Hikkaduwa,"Adara Graphics And Communication, No.9a Baddegama Road, Hikkaduwa",Adara Graphics And Communication,POINT (80.1009203 6.140715699999999)
Galle,Hikkaduwa,"Little Hut Communication, Aluthwala, Hikkaduwa",Little Hut Communication,POINT (80.1390061 6.1823409)
Galle,Hikkaduwa,"NAVORA COMMUNICATION, BADDEGAMA RD, HIKKADUWA",NAVORA COMMUNICATION,POINT (80.10116579999999 6.1338253)
Galle,Hikkaduwa,"Tour SL Tours, Galle Rd,Narigama, hikkaduwa",Tour SL Tours,POINT (80.1109598 6.1242652)
Galle,Hikkaduwa,"Nilu Communication, No.7 Galle Road, Hikkaduwa",Nilu Communication,POINT (80.1090279 6.1252965)
Galle,Hikkaduwa,"Digital Cellular, No.286 Galle Road, Hikkaduwa",Digital Cellular,POINT (80.10150329999999 6.1317032)
Galle,Hiniduma,"HINIDUMA VIDEO, NUGAGALA JUNTION, HINIDUMA",HINIDUMA VIDEO,POINT (80.33964739999999 6.296244799999999)
Galle,Hiniduma,"Kosala Cycle, Hiniduma North, Hiniduma",Kosala Cycle,POINT (80.31657610000001 6.314563499999999)
Galle,Karapitiya,"WELLFAIRE COMMUNICATION, KARAPITIYA, GALLE",WELLFAIRE COMMUNICATION,POINT (80.2250421 6.0671101)
Galle,Kosgoda,"Shan Grocery, Galle Road Duwemodara, Kosgoda",Shan Grocery,POINT (80.0230741 6.3467525)
Galle,Thalpe,"Nishantha Phone Shop, Wellethota Road, Thalpe",Nishantha Phone Shop,POINT (80.28156509999999 5.9975934)
Galle,Thalpe,"Wickrama Stores, Wellethota Road, Thalpe",Wickrama Stores,POINT (80.2819853 5.9997469)
Galle,Udugama,"Pradeep Communication, Opposite The School, Udugama",Pradeep Communication,POINT (80.1818909 6.6461421)
Galle,Udugama,"Dayananda Stores, Bar Junction, Udugama",Dayananda Stores,POINT (80.33514009999999 6.201796)
Galle,Udugama,"Chathura Communication, Galle Road, Udugama South",Chathura Communication,POINT (80.342393 6.1852718)
Galle,Wanduramba,"SONATA COMMUNICATION, MAPALAGAMA RD, WANDURAMBA",SONATA COMMUNICATION,POINT (80.2547374 6.134818099999999)
Gampaha,Gampaha,"SAKU CELL DREEMS,  UDGAMPALA JUNCTION, GAMPAHA",SAKU CELL DREEMS,POINT (80.01137480000001 7.087978199999999)
Gampaha,Gampaha,"Eshan Book Shop Communication, No.146/A Yakkala Road, Gampaha",Eshan Book Shop Communication,POINT (79.9939468 7.092771699999999)
