District,City,Address,outlet_name,store_location
Ampara,Ampara,"Senevirathne Hotel, Ampara Road, Mahaoya",Senevirathne Hotel,POINT (79.87558799999999 7.283174)
Ampara,Ampara,"WIKRAMA COMMUNICATION, GONAGOLLA,GALAPITAGALA",WIKRAMA COMMUNICATION,POINT (80.99021499999999 7.333009)
Ampara,Ampara,"Global Communication, Batticaloa Road, Kalmunai, Main Street",Global Communication,POINT (79.8570663 6.8961749)
Ampara,Ampara,"House Of Power, P M C Road, Sainthamaruthu",House Of Power,POINT (81.8342923 7.394248500000001)
Ampara,Ampara,"YASASA CELLULER, KEKIRIHENA, MAHAOYA",YASASA CELLULER,POINT (81.3263838 7.5017075)
Ampara,Addalachenai,"Sasa Multi Com, Main Street, Addalaichenai",Sasa Multi Com,POINT (81.8542195 7.2558857)
Ampara,Dehiattakandiya,"Isodha Cellular, No.25 New Town Dipot Road, Dehiattakandiya",Isodha Cellular,POINT (81.0472262 7.6703416)
Ampara,Hingurana,"Nanayakkara Book Shop, No.6 Main Street, Hingurana",Nanayakkara Book Shop,POINT (81.672674 7.2283542)
Ampara,Kalmunai,"SIVA TRADERS, AMMAN KOVIL ROAD, KALMUNAI, KALMUNAI",SIVA TRADERS,POINT (81.82838319999999 7.412533)
Ampara,Kalmunai,"Esential, Main Street, Kalmunai, Bus stant",Esential,POINT (81.82358549999999 7.4168639)
Ampara,Kalmunai,"House Of Power, P M C Road, Sainthamaruthu, Kalmunai",House Of Power,POINT (81.8342923 7.394248500000001)
Ampara,Marthamunai,"Ajinas Phone Shop, Main Street, Maruthamunai",Ajinas Phone Shop,POINT (81.81322179999999 7.4368379)
Ampara,Marthamunai,"JISNA SATELLITE SYSTEM, MAIN STREET,MARTHAMUNAI",JISNA SATELLITE SYSTEM,POINT (79.8533577 6.921549400000001)
Ampara,Ninthavur,"Mega Communication, Main Street, Nintavur, 338,Hijra Road",Mega Communication,POINT (79.8570493 6.9366021)
Ampara,Pothuvil,"Business Baith, Nasjidhul Falah Road, Pottuvil",Business Baith,POINT (81.8314506 6.8693312)
Ampara,Pothuvil,"BANU STORES, PUTTLAM RD, LAHUGALA, Main Street,Pottuvil",BANU STORES,POINT (81.8298502 6.874721699999999)
Ampara,Pothuvil,"Bark Home System, Main Street, Arungambi, Pothuwil",Bark Home System,POINT (79.85176249999999 6.937959)
Ampara,Sammanthurai,"NIYAS STORES, 471/B,OLD MARKET ROAD,SAINTHAMARTHU-03",NIYAS STORES,POINT (81.8307118 7.407258599999999)
Ampara,Sammanthurai,"Top World, Osman Road, Sainthamaruthu 6, 256 PM Lean",Top World,POINT (81.83492769999999 7.3952132)
Ampara,Sammanthurai,"NIYAS BOOKING CENTER, 144,AMPARA ROAD,SAMMANTHURAI, AMPARA",NIYAS BOOKING CENTER,POINT (81.80437550000001 7.3643753)
Ampara,Sammanthurai,"Hijra Communication, Hijra Junction, Sammanthurai, 118 Bloak-J-East",Hijra Communication,POINT (81.8036292 7.362093099999999)
Ampara,Sammanthurai,"Star Communication, No.20 ,Ampara Road, Sammanthurai",Star Communication,POINT (81.80388339999999 7.363205)
Ampara,Sammanthurai,"Nusky Mobile, No.162 Police Road, Sammanthurai",Nusky Mobile,POINT (81.82534969999999 7.4150105)
Ampara,Sammanthurai,"Millenium Mark Communication, Ampara Road, Sammanthurai",Millenium Mark Communication,POINT (81.8057147 7.3699233)
Anuradhapura,Anuradhapura,"Helana Communication, Bank Side, Main Street",Helana Communication,POINT (80.4111635 8.335324099999999)
Anuradhapura,Anuradhapura,"Siri sanda Stores, 205,Bandaranayaka Mw, Anuradhapura",Siri sanda Stores,POINT (80.39195479999999 8.371489500000001)
Anuradhapura,Anuradhapura,"Phone 4 U, Main Street Bank Side, Anuradhapura",Phone 4 U,POINT (80.41138719999999 8.336106299999999)
Anuradhapura,Anuradhapura,"Univesal cellular ( Pvt ) ltd, Maithreepala senanayaka M.W  Anuradhapura, Anuradhapura",Univesal cellular ( Pvt ) ltd,POINT (80.4010438 8.321009799999999)
Anuradhapura,Anuradhapura,"SANDAMALEE COMMUNICATION, SRAWASTHIPURA, ANURADHAPURA",SANDAMALEE COMMUNICATION,POINT (79.84756820000001 7.3126216)
Anuradhapura,Anuradhapura,"NALIN STORSE, AKKARA 111,PANDULAGAMA, ANURADHAPURA",NALIN STORSE,POINT (80.36110909999999 8.327515999999999)
Anuradhapura,Anuradhapura,"CHANCE SNACKS & GROCERIES,  512/A FREEMAN MAWATHA, ANURADHAPURA",CHANCE SNACKS & GROCERIES,POINT (80.4159129 8.3158954)
Anuradhapura,Anuradhapura,"IRU CELLULAR, 561/2, NEW BUS STAND, ANURADHAPURA",IRU CELLULAR,POINT (80.40365079999999 8.311351699999999)
Anuradhapura,Anuradhapura,"NAWAS COMMUNICATION, KOONWEWA, MAHAPOTHANA",NAWAS COMMUNICATION,POINT (80.7480741 8.4091211)
Anuradhapura,Anuradhapura,"DILKY PHONE HOUSE., ABEYPURA, PADAVIPARAKRAMAPURA",DILKY PHONE HOUSE.,POINT (80.77570200000001 8.903964)
Anuradhapura,Eppawala,"Nikini COMMUNICATION, 34 KEKIRAWA RD,EPPAWALA",Nikini COMMUNICATION,POINT (80.3532266 8.232377399999999)
Anuradhapura,Habarana,"Kalyani Communication, Bazaar, Habarana",Kalyani Communication,POINT (85.8620767 20.2894699)
Anuradhapura,Habarana,"Quick Communication, Dambulla Road, Habarana",Quick Communication,POINT (80.7549351 8.039058899999999)
Anuradhapura,Kahatagasdigiliya,"SEENA COMMUNICATION, TRINCOMALEE ROAD, KAHATAGASDIGILIYA",SEENA COMMUNICATION,POINT (81.2127399 8.653949299999999)
Anuradhapura,Kebithigollewa,"Nanda Trade Centre, Main Street, Kebithigollewa",Nanda Trade Centre,POINT (79.8533577 6.921549400000001)
Anuradhapura,Kebithigollewa,"DATA COMM, PADAVIYA RD, KEBITHIGOLLEWA",DATA COMM,POINT (80.7589021 8.8354122)
Anuradhapura,Kebithigollewa,"Madusanka Book shop, Wahalkada, Kebithigollawa",Madusanka Book shop,POINT (80.34985229999999 7.2536844)
Anuradhapura,Kekirawa,"UNION CELLULER, THALAWA RD, KEKIRAWA",UNION CELLULER,POINT (80.59553679999999 8.040666399999999)
Anuradhapura,Kekirawa,"JIFERIYA STORES, 06 THALAWA RD,KEKIRAWA",JIFERIYA STORES,POINT (80.5959713 8.0409738)
Anuradhapura,Kekirawa,"Hameediya Stores, No.44 Main Street, Kekirawa",Hameediya Stores,POINT (80.59795679999999 8.040018)
Anuradhapura,Kekirawa,"NEW CITY COMMUNICATION, GANEWALPOLA RD,KEKIRAWA",NEW CITY COMMUNICATION,POINT (80.59679369999999 8.040891499999999)
Anuradhapura,Medawachchiya,"MAX PHONE ARCADE, NO.9,SHOPING COMPLEX, MADAWACHCHIYA",MAX PHONE ARCADE,POINT (80.40307319999999 8.323240499999999)
Anuradhapura,Mihintale,"Lakpura Communication, Main Street, Mihintale",Lakpura Communication,POINT (79.87923019999999 6.8060449)
Anuradhapura,Mihintale,"Astro Communication, Mihinthale Town, Mihinthale",Astro Communication,POINT (80.51148739999999 8.358723599999999)
Anuradhapura,Mihintale,"Araliya Communication, Mihinthale Town, Mihinthale",Araliya Communication,POINT (79.93401659999999 6.9264988)
Anuradhapura,Mihintale,"Petrol Shed Lanka Filling Centre, Main Street, Mihintale",Petrol Shed Lanka Filling Centre,POINT (79.89853099999999 6.8639693)
Anuradhapura,Nochchiyagama,"THARU COMMUNICATION & MALIN ELECTRICALS, RAJINA JUNCTION,NoCHCHIYAGAMA",THARU COMMUNICATION & MALIN ELECTRICALS,POINT (80.7327737 6.0488883)
Anuradhapura,Nochchiyagama,"Suramya Communication., Puttalam Rd, Nochchiyagama",Suramya Communication.,POINT (80.20440789999999 8.260858899999999)
Anuradhapura,Padaviya,"MILAN COMMUNICATION, PADAVI, PARAKRAMAPURA",MILAN COMMUNICATION,POINT (80.77570200000001 8.903964)
Anuradhapura,Pubbogama,"Roshan Communication, New Town, Galkiriyagama",Roshan Communication,POINT (80.570881 7.828863399999999)
Anuradhapura,Rambewa,"Chathuranga Communication, Main Street, Rambewa",Chathuranga Communication,POINT (80.60883219999999 6.925175299999999)
Anuradhapura,Rambewa,"Sithmal Communication, Main Street, Rambewa",Sithmal Communication,POINT (79.8533577 6.921549400000001)
Anuradhapura,Rambewa,"Sena Super Mart, Jaffna Road Main Street, Rambewa",Sena Super Mart,POINT (80.5067248 8.4430227)
Anuradhapura,Rambewa,"SAYUMI BOOKSHOP, Pallankulama Road, Rambewa",SAYUMI BOOKSHOP,POINT (79.8559102 6.937862)
Anuradhapura,Tambuttegama,"JAYASIRI COMM, BUS STAND, THAMBUTTEGAMA",JAYASIRI COMM,POINT (79.93023700000001 6.979217299999999)
Anuradhapura,Tambuttegama,"Nethmini Fashion And Book Shop, Musalpitiya, Thambuttegama",Nethmini Fashion And Book Shop,POINT (80.29651389999999 8.1545305)
Badulla,Badulla,"The Phone Factory And Communication, No.19 Viharagoda Bank RoadBadulla",The Phone Factory And Communication,POINT (81.0599603 6.9844078)
Badulla,Badulla,"Nanda Stores, 19 , Springweli Rd , Badulla",Nanda Stores,POINT (81.06920099999999 6.982957)
Badulla,Badulla,"Hansa Studio, Kahataruppa , Badulla., Kahataruppa",Hansa Studio,POINT (81.116086 7.0236926)
Badulla,Badulla,"Call Center, No.02 Bus Stand, Badulla, Badulla",Call Center,POINT (81.05789369999999 6.9877357)
Badulla,Badulla,"Little Jhones, No.25-b Complex Bus Stand, Badulla, Badulla",Little Jhones,POINT (81.0575872 6.9878391)
Badulla,Badulla,"Ontrack Com, No.281 Passara Road, Badulla",Ontrack Com,POINT (81.0541757 6.993534299999999)
Badulla,Badulla,"DMW  NETWORK, NO.02,KANDY ROAD, MEEGAHAKIULA",DMW  NETWORK,POINT (79.9566564 7.0048193)
Badulla,Badulla,"C3 Communication, No.1a Dharmadutha Rd, Badulla",C3 Communication,POINT (81.0594461 6.9880447)
Badulla,Badulla,"Speedlink Communication Centre, No.10 Lower Street, Badulla",Speedlink Communication Centre,POINT (81.05973639999999 6.9856661)
Badulla,Badulla,"Rainbow Call, 05/06,bus Stand, Badulla",Rainbow Call,POINT (81.05757349999999 6.9879886)
Badulla,Badulla,"New Ranjaya Communication, No.69 Kanupelella Road, Badulla",New Ranjaya Communication,POINT (81.06121929999999 6.979945400000001)
Badulla,Badulla,"Deen Communication, No.10 Bus Stand, Badulla",Deen Communication,POINT (81.05757349999999 6.9879886)
Badulla,Badulla,"Deepani Communication, No.19 Bandarawela Road, Badulla",Deepani Communication,POINT (81.05392449999999 6.9907378)
Badulla,Badulla,"Sri Krishna Com, Main Street , Lunugala",Sri Krishna Com,POINT (80.6769731 7.5206335)
Badulla,Badulla,"Deepani Communication, No.19 Bandarawela Road , Badulla",Deepani Communication,POINT (81.05392449999999 6.9907378)
Badulla,Badulla,"FAWZUL M CENTER, HALANGAHAPOLA BAZER, RENDAPOLA",FAWZUL M CENTER,POINT (80.8312507 6.916786699999999)
Badulla,Bandarawela,"E.M.K.Communication, No.29 Dharmawijaya Mawatha, Bandarawela",E.M.K.Communication,POINT (80.98906389999999 6.8305947)
Badulla,Bandarawela,"NIPON COMMUNICATION, 37, 1ST FLOOR, MAIN STREET, BANDARAWELA",NIPON COMMUNICATION,POINT (81.00387889999999 6.8314627)
Badulla,Bandarawela,"NAMAL STORES, ATHTHALAPITIYA , BANDARAWELA",NAMAL STORES,POINT (80.9890023 6.8498087)
Badulla,Bandarawela,"LIYANGAHAWELA GROCERY, NO.21,LIYANGAHAWELA, BANDARAWELA",LIYANGAHAWELA GROCERY,POINT (81.0284229 6.8110625)
Badulla,Bandarawela,"GNANAM VIDEO, NO.17,DYRAAE ESTATE,, BANDARAWELA",GNANAM VIDEO,POINT (81.0018539 6.8063908)
Badulla,Diyatalawa,"OSHAN BOOK SHOP & COMMUNACATION, HELAKADURUGAMUWADIYATALAWA",OSHAN BOOK SHOP & COMMUNACATION,POINT (79.92354619999999 6.895281)
Badulla,Diyatalawa,"SAUSIRI COMMUNICATION & TECHNoLOGY, FAIR ROAD, DIYATALAWA",SAUSIRI COMMUNICATION & TECHNoLOGY,POINT (80.95590639999999 6.8067413)
Badulla,Diyatalawa,"MAURA ENTERPRISES, KAHAGOLLA , DIYATALAWA",MAURA ENTERPRISES,POINT (80.9748173 6.8194864)
Badulla,Diyatalawa,"AJEE COMMUNICATION, MAIN STREET, DIYATHALAWA",AJEE COMMUNICATION,POINT (80.95723149999999 6.8081312)
Badulla,Diyatalawa,"V F T S WELFEAR SHOP, V F T S CAMP, DIYATALAWA",V F T S WELFEAR SHOP,POINT (80.9579509 6.813037899999999)
Badulla,Girandurukotte,"Palitha Phone Center, New TownGirandurukotte",Palitha Phone Center,POINT (81.01814069999999 7.472368299999999)
Badulla,Hali-Ela,"Mallika Group, Badulla Road , Hali Ela",Mallika Group,POINT (81.03302390000002 6.9574229)
Badulla,Hali-Ela,"MALLIKA TRADERS, NO.75,BADULLA RD, HALILLA",MALLIKA TRADERS,POINT (81.00115699999999 6.834289000000001)
Badulla,Hali-Ela,"Sumanasiri Hardware, Bandarawela Road Uduwara, Hali Ela, Udoowara",Sumanasiri Hardware,POINT (81.0405968 6.929659)
Badulla,Hali-Ela,"Fathima Stores, Galauda, Hali Ela",Fathima Stores,POINT (80.9862237 7.0400243)
Badulla,Hali-Ela,"KARUNARATHNA STORES & COMM, NO 12 & 14,BADULLA ROAD, HALIELA., HALIELA",KARUNARATHNA STORES & COMM,POINT (81.0318218 6.955781500000001)
Badulla,Kandaketiya,"Phone Repaire Center, No.U/3/B/2 Kadadapottawa, Badulu Oya, Kandaketiya",Phone Repaire Center,POINT (81.02192789999999 7.130595599999999)
Badulla,Lunugala,"DANALAKSHMEE STORES, NO 152 , MAIN STREET,   LUNUGALA",DANALAKSHMEE STORES,POINT (79.8643196 6.8607292)
Badulla,Mahiyanganaya,"Kottagoda Cellular, New Town, Mahiyanganaya, Mahiyanganaya",Kottagoda Cellular,POINT (80.99233699999999 7.338265099999999)
Badulla,Mahiyanganaya,"Sithija Cellular, No.15 Badulla Road Bus Stand, Mahiyanganaya",Sithija Cellular,POINT (80.99255359999999 7.339163399999999)
Badulla,Mahiyanganaya,"Anagi Communication, Redeekotaliya Badulla Road, Mahiyanganaya",Anagi Communication,POINT (80.9917497 7.3387083)
Badulla,Mahiyanganaya,"Jaan mobile mart & commiuinication, 15,PRIVAT BUS STAND, MAHIYANGANA",Jaan mobile mart & commiuinication,POINT (80.9921088 7.338807600000001)
Badulla,Mahiyanganaya,"Sharmila Book Shop, No.17 Badulla Rd Puja Town, Mahiyanganaya",Sharmila Book Shop,POINT (80.99076520000001 7.324104900000001)
Badulla,Meegahakivula,"Chandana Communication, Kandy Road, Meegahakivula, Meegahakiwla",Chandana Communication,POINT (81.0480939 7.137479099999999)
Badulla,Passara,"Manisras Fancy House, Main Street , Passara",Manisras Fancy House,POINT (79.9261795 6.846366799999999)
Badulla,Rideemaliyadda,"GURUGE STORES, rIDIMALIYADDA, RIDIMALIYADDA",GURUGE STORES,POINT (81.12247429999999 7.2166848)
Badulla,Welimada,"PRASAD GRAPHICS & COMPUTERS, No 95 , BADULLA ROAD, WELIMADA",PRASAD GRAPHICS & COMPUTERS,POINT (81.04301199999999 6.8879892)
Badulla,Welimada,"Sumanasiri Hardware, Bandarawela Road Uduwara, Hali Ela, Udoowara",Sumanasiri Hardware,POINT (81.0405968 6.929659)
Badulla,Welimada,"Gajamuthu Trade Centre, Ranhawadigama, Uva Paranagama",Gajamuthu Trade Centre,POINT (80.880366 6.951430999999999)
Badulla,Welimada,"ROSHI CREATIONS, OLD POST OFFICE ROAD, WELIMADA",ROSHI CREATIONS,POINT (80.9122831 6.9051646)
Badulla,Welimada,"JAYAMAGA STORES, NO 1/29 , DIURUMGAMA,NUGATHALAWA, WELIMADA",JAYAMAGA STORES,POINT (80.90792449999999 6.901907200000001)
Badulla,Welimada,"NEW KUBRA JEWELERS & COM, NO.46, BADULLA ROAD, WELIMADA",NEW KUBRA JEWELERS & COM,POINT (80.91198919999999 6.9055217)
Badulla,Welimada,"VIPULA STORES, GIRAABE , NUGATHALAWA, WELIMADA",VIPULA STORES,POINT (80.9159458 6.9052345)
Badulla,Welimada,"KUMARA HOTEL & COMMUNICATION, BANDARAWELA RD,DIVITHOTAWELA, WELIMADA",KUMARA HOTEL & COMMUNICATION,POINT (80.9159458 6.9052345)
Colombo,Angoda,"Purasanda Communication And Internet Cafe, No.04 Hospital Road, Angoda",Purasanda Communication And Internet Cafe,POINT (79.93175339999999 6.885803)
Colombo,Angoda,"SAHANA COMMUNICATION, 219/1,KELANIMULLA,ANGODA",SAHANA COMMUNICATION,POINT (79.92068019999999 6.9412743)
Colombo,Angoda,"Yusara Com, No.594 J/Avissawella Rd, Angoda",Yusara Com,POINT (79.89475849999999 6.938597799999999)
Colombo,Angoda,"M.S.MOBILE, 6B,MAHABUTHGAMUWA, KOTIKAWATHTHA",M.S.MOBILE,POINT (79.85176249999999 6.937959)
Colombo,Athurugiriya,"sureka  comm, 278/2  godagama   road   athurugiriya",sureka  comm,POINT (79.9958305 6.865114300000001)
Colombo,Athurugiriya,"FRESH & EASY, 2010,MILLENIUE CITY, ATHURUGIRIYA",FRESH & EASY,POINT (79.9867206 6.8792209)
Colombo,Athurugiriya,"SHA COM, 5, SHANTHALOKAGAMA, ORUWALA, ATHURUGIRIYA",SHA COM,POINT (79.9681552 6.886564799999999)
Colombo,Athurugiriya,"SUHADA COMMUNICATION, 57, MAIN STREET, ATHURUGIRIYA",SUHADA COMMUNICATION,POINT (79.910056 6.867414999999999)
Colombo,Athurugiriya,"Walgama Communication, No.1/425 Walagama Junction, Athurugiriya",Walgama Communication,POINT (79.9958305 6.865114300000001)
Colombo,Atul Kotte,"SITHWAY E-CAFE, 27, ANANDABALIKA MW, KOTTE",SITHWAY E-CAFE,POINT (79.8970346 6.885642)
Colombo,Avissawella,"Pathum Book Shop, No.05 Kudagama Road Ukwatta Junction, Avissawella",Pathum Book Shop,POINT (80.2042799 6.9550082)
Colombo,Avissawella,"DEPTI  COMUNICATION, R 39, AVISSAWELLA",DEPTI  COMUNICATION,POINT (80.2129109 6.951250399999999)
Colombo,Avissawella,"Iresha Communication, Police Junction, Kosgama",Iresha Communication,POINT (80.1378687 6.9465971)
Colombo,Avissawella,"OASIS COMMIUNICATION, IHALA KOSGAMAKOSGAMA",OASIS COMMIUNICATION,POINT (80.1216106 6.945348099999999)
Colombo,Avissawella,"Pathirana Comiunication, Thummodara Road,Puwakpitiya",Pathirana Comiunication,POINT (80.1876721 6.923955899999999)
Colombo,Avissawella,"JANANEE COMMUNICATION, 22,SUPER MARKET,HANWELA",JANANEE COMMUNICATION,POINT (80.0814901 6.908964000000001)
Colombo,Avissawella,"CHATHURANGA COMMUNICATION, PINNAWALA, WAGA",CHATHURANGA COMMUNICATION,POINT (80.12566939999999 6.8987303)
Colombo,Avissawella,"Munasinghe Stores, No.72 Pinnawala, Waga",Munasinghe Stores,POINT (80.12162669999999 6.8722365)
Colombo,Avissawella,"Nisansala Communication, Labugama Road Mabula, Waga",Nisansala Communication,POINT (80.14652219999999 6.8674048)
Colombo,Avissawella,"SEYARO E-SOLUTION, 27,KAHAHENA, WAGA",SEYARO E-SOLUTION,POINT (80.1279632 6.9009746)
Colombo,Avissawella,"Silverline Communication, No.67b Yatiyanthota Road, Avissawella",Silverline Communication,POINT (79.9864821 6.941621)
Colombo,Avissawella,"Soba Communication, No.05 Yatiyanthota Road, Avissawella",Soba Communication,POINT (80.212323 6.9530826)
Colombo,Avissawella,"S A MOBILE, 09, NEW SHOPPING COMPLEX,, AVISSAWELLLA",S A MOBILE,POINT (79.9074409 6.7163723)
Colombo,Avissawella,"Odil, No.R33 New Marketing Complex Rathnapura Road, Avissawella",Odil,POINT (80.2166177 6.9336083)
Colombo,Avissawella,"Sri Jaya Com, No.7,Rathnapura rd, Avissawella",Sri Jaya Com,POINT (80.21246270000002 6.9529321)
Colombo,Avissawella,"Manahara Bookshop And Communication, No.39 Rathnapura Road, Avissawella",Manahara Bookshop And Communication,POINT (80.213375 6.951108000000001)
Colombo,Avissawella,"Book Mark Book Shop, Pahala, Kosgama,, Kosgama",Book Mark Book Shop,POINT (80.1373289 6.9412971)
Colombo,Bambalapitiya,"Bobby Communication, No.443/C Galle Road, Bambalapitiya",Bobby Communication,POINT (79.859464 6.880972)
Colombo,Bandaragama,"Chamara Book Shop, Kesbewa Road,Bandaragama",Chamara Book Shop,POINT (79.9887614 6.7144786)
Colombo,Bandaragama,"Chandra Vedio, No.37,Kesbewa Road,Bandaragama",Chandra Vedio,POINT (79.92415459999999 6.8004026)
Colombo,Battaramulla,"Vibhasha Communication, No.205 Kaduwela Road, Battaramulla",Vibhasha Communication,POINT (79.9277263 6.905693200000001)
Colombo,Battaramulla,"SHA COM, 565/B,KOSWATTA RD,THALANGAMA NoRTH,BATTARAMULLA",SHA COM,POINT (79.93289109999999 6.9037194)
Colombo,Battaramulla,"SMJ MOBILE ZONE, NO 83, KADUWELA ROAD, BATTARAMULLA",SMJ MOBILE ZONE,POINT (79.9263296 6.8933974)
Colombo,Boralasgamuwa,"S S Com, No.217 Egodawatta Rd, Boralesgamuwa",S S Com,POINT (79.9063372 6.8504238)
Colombo,Boralasgamuwa,"Ransara Communication, No.196 Kesbewa Road, Boralesgamuwa",Ransara Communication,POINT (79.89777289999999 6.8488794)
Colombo,Colombo,"Brighten Mobile Center., No:130,Malay Street, Colombo 02",Brighten Mobile Center.,POINT (79.85066359999999 6.924604899999999)
Colombo,Colombo,"V.SHANTHINI, NO.34,BODHIRAJA MW, COLOMBO-11",V.SHANTHINI,POINT (79.85420409999999 6.9364683)
Colombo,Colombo,"APPLE Reload, PRINCE STREET, COLOMBO 11",APPLE Reload,POINT (79.85066359999999 6.9355319)
Colombo,Colombo,"SKY Line Telecom, 122  York street, Colombo 01",SKY Line Telecom,POINT (79.84693999999999 6.934578399999999)
Colombo,Colombo,"NEW STAR SEIECTION,  1154,OLCOTT MW, COLOMBO 11",NEW STAR SEIECTION,POINT (79.85024159999999 6.9342412)
Colombo,Colombo,"HI DEE TRADERS, 43, BAUDDHALOKA MW., COLOMBO 04",HI DEE TRADERS,POINT (79.85580779999999 6.895775)
Colombo,Colombo,"Thusitha Book Shop And Communication, No.28 Avissawella Rd, Orugodawatta",Thusitha Book Shop And Communication,POINT (79.8805764 6.944383699999999)
Colombo,Colombo,"Upekshika Communication, No.47/H/9 Rawatta Lane, Colombo 15",Upekshika Communication,POINT (79.85343259999999 6.9006583)
Colombo,Colombo,"MILINDA COMMUNICATION, NO.157,ST.ANDREWS PLACE, COLOMBO-15., Colombo 15",MILINDA COMMUNICATION,POINT (79.8599782 6.958709799999999)
Colombo,Colombo,"Metro Communication And Fancy, No.380 Modara Street, Colombo 15",Metro Communication And Fancy,POINT (79.8726379 6.970283800000001)
Colombo,Colombo,"Blackbeery Communication , 338, Alvitigala Mawatha , COLOMBO 05",Blackbeery Communication ,POINT (79.8769514 6.8989205)
Colombo,Colombo,"NEW GLOBAL COMMUNICATION, NO.334, ELVITIGALA MW,   NARAHENPITA, COLOMBO-05",NEW GLOBAL COMMUNICATION,POINT (79.876953 6.8989702)
Colombo,Colombo,"GUNA COMMUNICATION, 3,MAYBLE ROAD KOTAHENA, COLOMBO13",GUNA COMMUNICATION,POINT (79.862765 6.9517742)
Colombo,Colombo,"RATHNA TAILORS, NO.480B,BLUMENDHALNRD, COLOMBO13",RATHNA TAILORS,POINT (79.8528536 6.9401452)
Colombo,Colombo,"New Dehiwala Multi Pharmacy And Grocery, No.E/2/G/2 Maligawatta Housing Scheme, Colombo 10",New Dehiwala Multi Pharmacy And Grocery,POINT (79.8696094 6.8768588)
Colombo,Colombo,"Hidayas Communication, No.167 Deans Road Maradana, Colombo 10",Hidayas Communication,POINT (79.8533577 6.921549400000001)
Colombo,Colombo,"G.K.Communication, No.112a Deans Road Maradana, Colombo 10",G.K.Communication,POINT (79.8651266 6.9248997)
Colombo,Colombo,"Ai - Asbaab Explorer & Com, No.146,Leyards Broadway, Colombo 14",Ai - Asbaab Explorer & Com,POINT (79.86748419999999 6.944525199999999)
Colombo,Colombo,"NILU COMMUNICATION, E4, KAMKARUPURA FLAT,ORUGODAWATTA, COLOMBO 14",NILU COMMUNICATION,POINT (79.8701306 6.9441115)
Colombo,Colombo,"Nero Telecom, No.16 Bapist Chapel Road, Colombo 07",Nero Telecom,POINT (79.89389779999999 6.8721529)
Colombo,Colombo,"Yasa Isuru Communication, No.D 75/260 Saranapalahimi Mw Borella, Colombo 8",Yasa Isuru Communication,POINT (79.876097 6.9154943)
Colombo,Colombo,"Kandy Food Carner And Communication, No.582/1a Baseline Road Dematagoda, Colombo 9",Kandy Food Carner And Communication,POINT (79.87842599999999 6.9372231)
Colombo,Colombo,"Rikaz Stores, No.371,Jumma Musjid Road,Maligawatta, Colombo 10",Rikaz Stores,POINT (79.8723146 6.9368653)
Colombo,Colombo,"Safraz Communication, No.07,Dias Place,Gunasinghepura, Colombo 12",Safraz Communication,POINT (79.85768569999999 6.9368175)
Colombo,Colombo,"SMART HOUSE, NO.187,GALLE RD, COLOMBO-03",SMART HOUSE,POINT (79.84926179999999 6.9130962)
Colombo,Colombo,"Samsung Smart Cafe, No 61/1 A, Stace Road, Colombo 14",Samsung Smart Cafe,POINT (79.8762593 6.9435927)
Colombo,Colombo,"Ranji Fancy, No.197 Modara Street, Colombo 15",Ranji Fancy,POINT (79.87251619999999 6.9703642)
Colombo,Colombo,"V N R Enterprises And Communication, No.171 Muthuwella Mawatha, Colombo 15",V N R Enterprises And Communication,POINT (79.8631681 6.962135699999999)
Colombo,Colombo,"Kaman Communication, No.110/3,Delasal Street,Modara,Colombo 15., Colombo 15",Kaman Communication,POINT (79.862337 6.962210799999999)
Colombo,Colombo,"COM SYSTEM COM, NO.72,AWISSAWELLA RD, ORUGODAWATTA",COM SYSTEM COM,POINT (79.88333449999999 6.947515999999999)
Colombo,Colombo,"3G MOBILE, HIGH LEVEL ROAD, KIRULAPONE",3G MOBILE,POINT (79.8712721 6.822941999999999)
Colombo,Colombo,"Designcom Pvt Ltd, No.106 Pamankada Road, Colombo 05",Designcom Pvt Ltd,POINT (79.87262969999999 6.878377100000001)
Colombo,Colombo,"Phone Lanka., No: 49 A,Union Place, Colombo 02",Phone Lanka.,POINT (79.8531627 6.9224048)
Colombo,Colombo,"SPEED @ I NET, NO.206B,GALLE RD, COLOMBO-06",SPEED @ I NET,POINT (79.86163759999999 6.8722448)
Colombo,Colombo,"Techno Net Cafe, Hampden Lane, Colombo 06",Techno Net Cafe,POINT (79.8663347 6.8735921)
Colombo,Colombo,"Mamco Agency Post Office, No.408/B Maradana Rd, Colombo 10",Mamco Agency Post Office,POINT (79.87086429999999 6.9212929)
Colombo,Colombo,"City Com, No.10 Mahakumarage Mawatha, Colombo 14",City Com,POINT (79.87147569999999 6.9471265)
Colombo,Colombo,"Ashoka Communication, No.432 Grandpass Road, Colombo 14",Ashoka Communication,POINT (79.8533577 6.921549400000001)
Colombo,Colombo,"Tranceworld Communication, No.194/A Mohideen Masjid Road Maradana, Colombo 10",Tranceworld Communication,POINT (79.860564 6.939397)
Colombo,Colombo,"M.S.A.GHANY, NO.180,MOHIDEEN MASJID RD,MARADANA, COLOMBO-10",M.S.A.GHANY,POINT (79.8645892 6.9319891)
Colombo,Colombo,"Amaan At Cafe, No.388a Baseline Rd Dematagoda, Colombo 9",Amaan At Cafe,POINT (79.878193 6.9307945)
Colombo,Colombo,"Mathu Video Pvt Ltd, No.163 New Chetty Street, Colombo 13",Mathu Video Pvt Ltd,POINT (79.8596354 6.9455487)
Colombo,Colombo,"Sumo Pharmacy, No.45/A Kotahena Street, Colombo 13",Sumo Pharmacy,POINT (79.8623003 6.947773)
Colombo,Colombo,"Global Communication, No.255 14th Division Maradana, Colombo 10",Global Communication,POINT (79.8656089 6.9272771)
Colombo,Colombo,"MOBILIX LANKA (PVT)LTD, 562,GALLE ROAD, COLOMBO 05",MOBILIX LANKA (PVT)LTD,POINT (79.8530171 6.9012832)
Colombo,Colombo,"WASANA COMMUNICATION, NO.351,KIRIWANDAL, PUWAKPITIYA",WASANA COMMUNICATION,POINT (80.1930181 6.935517399999999)
Colombo,Colombo,"Sriram Communication, No.240 Mahavidyalaya Mawatha, Colombo 13",Sriram Communication,POINT (79.8603765 6.9417803)
Colombo,Colombo,"TIRANTHA COMMUNICATION, KOLLONNAWA, COLOMBO 14",TIRANTHA COMMUNICATION,POINT (79.8701306 6.9441115)
Colombo,Colombo,"SAMPATH ENTERPRIES, 4/6, ELVITIGALA  RD, , COLOMBO, 08",SAMPATH ENTERPRIES,POINT (79.87728559999999 6.8945754)
Colombo,Colombo,"Orbit Communication, No.1053 Maradana Road Borella, Colombo 8",Orbit Communication,POINT (79.87353159999999 6.919098)
Colombo,Colombo,"Feathers Com, No.1076,Maradana Road,Borella,, Colombo 08",Feathers Com,POINT (79.8771261 6.9150037)
Colombo,Colombo,"Sarath Stores, No.59/49B,Baseline mw,Colombo 09, Colombo 09",Sarath Stores,POINT (79.86135469999999 6.927243799999999)
Colombo,Colombo,"Prakshana Com, No.321 Sea Street, Colombo 11",Prakshana Com,POINT (79.85404299999999 6.93945)
Colombo,Colombo,"Shakiras, No.51 D York Street, Colombo 01",Shakiras,POINT (79.84555259999999 6.9355177)
Colombo,Colombo,"NAFEES COMMUNICATION, 309, DEMATAGODA RD,, 0EMATAGODA,COLOMBO 09",NAFEES COMMUNICATION,POINT (79.8785999 6.9386437)
Colombo,Colombo,"MEGA BYTE COMMUNICATION, NO.245,1ST DIVISION,, MARADANA,COLOMBO 10",MEGA BYTE COMMUNICATION,POINT (79.8689971 6.9233595)
Colombo,Colombo,"Mega Byte Communication, No.118B,Jampettah Street,, COLOMBO 13",Mega Byte Communication,POINT (79.8592532 6.9460466)
